Sheet: SouÄet bodÅ¯
B2: Ãloha
A3: StartovnÃ­ ÄÃ­slo | B3: 1 | C3: Celkem
A4: koef | B4: 1
A5: 1 | B5: ='Ãloha 1'!RC[68] * R[-1]C -> 2 | C5: =SUM(RC[-1]:RC[-1]) -> 2
A6: 2 | B6: ='Ãloha 1'!RC[68] * R[-2]C -> 2 | C6: =SUM(RC[-1]:RC[-1]) -> 2
A7: 3 | B7: ='Ãloha 1'!RC[68] * R[-3]C -> 2 | C7: =SUM(RC[-1]:RC[-1]) -> 2
A8: 4 | B8: ='Ãloha 1'!RC[68] * R[-4]C -> 2 | C8: =SUM(RC[-1]:RC[-1]) -> 2
A9: 5 | B9: ='Ãloha 1'!RC[68] * R[-5]C -> 2 | C9: =SUM(RC[-1]:RC[-1]) -> 2
A10: 6 | B10: ='Ãloha 1'!RC[68] * R[-6]C -> 2 | C10: =SUM(RC[-1]:RC[-1]) -> 2
A11: 7 | B11: ='Ãloha 1'!RC[68] * R[-7]C -> 2 | C11: =SUM(RC[-1]:RC[-1]) -> 2
A12: 8 | B12: ='Ãloha 1'!RC[68] * R[-8]C -> 2 | C12: =SUM(RC[-1]:RC[-1]) -> 2
A13: 9 | B13: ='Ãloha 1'!RC[68] * R[-9]C -> 2 | C13: =SUM(RC[-1]:RC[-1]) -> 2
A14: 10 | B14: ='Ãloha 1'!RC[68] * R[-10]C -> 2 | C14: =SUM(RC[-1]:RC[-1]) -> 2
A15: 11 | B15: ='Ãloha 1'!RC[68] * R[-11]C -> 2 | C15: =SUM(RC[-1]:RC[-1]) -> 2
A16: 12 | B16: ='Ãloha 1'!RC[68] * R[-12]C -> 2 | C16: =SUM(RC[-1]:RC[-1]) -> 2
A17: 13 | B17: ='Ãloha 1'!RC[68] * R[-13]C -> 2 | C17: =SUM(RC[-1]:RC[-1]) -> 2
A18: 14 | B18: ='Ãloha 1'!RC[68] * R[-14]C -> 2 | C18: =SUM(RC[-1]:RC[-1]) -> 2
A19: 15 | B19: ='Ãloha 1'!RC[68] * R[-15]C -> 2 | C19: =SUM(RC[-1]:RC[-1]) -> 2
A20: 16 | B20: ='Ãloha 1'!RC[68] * R[-16]C -> 2 | C20: =SUM(RC[-1]:RC[-1]) -> 2
A21: 17 | B21: ='Ãloha 1'!RC[68] * R[-17]C -> 2 | C21: =SUM(RC[-1]:RC[-1]) -> 2
A22: 18 | B22: ='Ãloha 1'!RC[68] * R[-18]C -> 2 | C22: =SUM(RC[-1]:RC[-1]) -> 2
A23: 19 | B23: ='Ãloha 1'!RC[68] * R[-19]C -> 2 | C23: =SUM(RC[-1]:RC[-1]) -> 2
A24: 20 | B24: ='Ãloha 1'!RC[68] * R[-20]C -> 2 | C24: =SUM(RC[-1]:RC[-1]) -> 2
A25: 21 | B25: ='Ãloha 1'!RC[68] * R[-21]C -> 2 | C25: =SUM(RC[-1]:RC[-1]) -> 2
A26: 22 | B26: ='Ãloha 1'!RC[68] * R[-22]C -> 2 | C26: =SUM(RC[-1]:RC[-1]) -> 2
A27: 23 | B27: ='Ãloha 1'!RC[68] * R[-23]C -> 2 | C27: =SUM(RC[-1]:RC[-1]) -> 2
A28: 24 | B28: ='Ãloha 1'!RC[68] * R[-24]C -> 2 | C28: =SUM(RC[-1]:RC[-1]) -> 2
A29: 25 | B29: ='Ãloha 1'!RC[68] * R[-25]C -> 2 | C29: =SUM(RC[-1]:RC[-1]) -> 2
A30: 26 | B30: ='Ãloha 1'!RC[68] * R[-26]C -> 2 | C30: =SUM(RC[-1]:RC[-1]) -> 2
A31: 27 | B31: ='Ãloha 1'!RC[68] * R[-27]C -> 2 | C31: =SUM(RC[-1]:RC[-1]) -> 2
A32: 28 | B32: ='Ãloha 1'!RC[68] * R[-28]C -> 2 | C32: =SUM(RC[-1]:RC[-1]) -> 2
A33: 29 | B33: ='Ãloha 1'!RC[68] * R[-29]C -> 2 | C33: =SUM(RC[-1]:RC[-1]) -> 2
A34: 30 | B34: ='Ãloha 1'!RC[68] * R[-30]C -> 2 | C34: =SUM(RC[-1]:RC[-1]) -> 2

Sheet: Ãloha 1
A1: HodnocenÃ­ Ãºlohy Souboj tlaÄÃ­tek
B2: HodnotÃ­cÃ­ kritÃ©ria
A3: StartovnÃ­ ÄÃ­slo | B3: Hra se spouÅ¡tÃ­ stiskem obou tlaÄÃ­tek souÄasnÃ½m nebo postupnÃ½m. | C3: V Ãºvodu hry se rozsvÃ­tÃ­ levÃ¡ dioda, kdyÅ¾ levÃ½ hrÃ¡Ä stiskne tlaÄÃ­tko pro zahÃ¡jenÃ­. | D3: V Ãºvodu hry se rozsvÃ­tÃ­ pravÃ¡ dioda, kdyÅ¾ pravÃ½ hrÃ¡Ä stiskne tlaÄÃ­tko pro zahÃ¡jenÃ­. | E3: Na zaÄÃ¡tku novÃ© hry musÃ­ bÃ½t servo ve stÅedovÃ© poloze. | F3: Na zaÄÃ¡tku novÃ© hry je prostÅednÃ­ dioda pÃ¡su zelenÃ¡. | G3: PÅed startem hry indikaÄnÃ­ diody blikajÃ­. | H3: SÃ©riovÃ¡ linka pÅed startem zobrazuje "Game ready". | I3: Po startu hry se v sÃ©riovÃ© lince zobrazÃ­ "Game on". | J3: Stisk tlaÄÃ­tka vychÃ½lÃ­ indikaÄnÃ­ diodu v hernÃ­m reÅ¾imu. | K3: DrÅ¾enÃ­ jednoho z tlaÄÃ­tek neznemoÅ¾nÃ­ klikÃ¡nÃ­ druhÃ©ho tlaÄÃ­tka. | L3: TlaÄÃ­tka v hernÃ­m reÅ¾imu ovlivÅujÃ­ pÃ¡s LED. | M3: Na pÃ¡su svÃ­tÃ­ dioda indikujÃ­cÃ­ stav hry (pro levÃ©ho nebo pravÃ©ho hrÃ¡Äe). | N3: Na pÃ¡se vÅ¾dy svÃ­tÃ­ jen dvÄ diody souÄasnÄ (stÅedovÃ¡ a vÃ­tÄzÃ­cÃ­ hrÃ¡Ä). | O3: LevÃ½ hrÃ¡Ä mÃ¡ sprÃ¡vnou barvu "svÃ©" diody na pÃ¡se. | P3: PravÃ½ hrÃ¡Ä mÃ¡ sprÃ¡vnou barvu "svÃ©" diody na pÃ¡se. | Q3: Poloha ruÄiÄky na motorku odpovÃ­dÃ¡ stavu LED na pÃ¡sku. | R3: RozsvÃ­cenÃ© diody indikujÃ­cÃ­ vÃ­tÄze se na pÃ¡su pohybujÃ­ od stÅedu ke stranÃ¡m. | S3: LevÃ¡ indikaÄnÃ­ dioda svÃ­tÃ­ vÅ¾dy, kdyÅ¾ je ruÄiÄka vychÃ½lena na stranu levÃ©ho hrÃ¡Äe. | T3: TlaÄÃ­tka v hernÃ­m reÅ¾imu ovlivÅujÃ­ servo s ruÄiÄkou dle zadÃ¡nÃ­. | U3: Po 10 stisknutÃ­ch na levÃ© stranÄ je ruÄiÄka v levÃ© krajnÃ­ poloze. | V3: Po 10 stisknutÃ­ch na levÃ© stranÄ svÃ­tÃ­ nejlevÄjÅ¡Ã­ dioda v pÃ¡su. | W3: Hra se zastavÃ­, kdyÅ¾ jeden hrÃ¡ÄÅ¯ vede o deset stiskÅ¯. | X3: Dioda na stranÄ hrÃ¡Äe, jenÅ¾ prohrÃ¡l, po skonÄenÃ­ hry nesvÃ­tÃ­. | Y3: V zÃ¡vÄru hry blikÃ¡ dioda na stranÄ vÃ­tÄze. | Z3: SÃ©riovÃ¡ linka zobrazÃ­ po skonÄenÃ­ hry nÃ¡pis "Game over". | AA3: SÃ©riovÃ¡ linka zobrazÃ­ po skonÄenÃ­ hry skore hry. | AB3: SÃ©riovÃ¡ linka zobrazÃ­ po skonÄenÃ­ hry celkovÃ© skore od resetu. | AC3: 5 s po skonÄenÃ­ hry se ruÄiÄka vracÃ­ do stÅedovÃ© polohy. | AD3: 5 s po skonÄenÃ­ hry se rozsvÃ­tÃ­ stÅedovÃ¡ LED pÃ¡su zelenÄ. | AE3: Po ukonÄenÃ­ hry zaÅÃ­zenÃ­ 5 s nereaguje na stisk tlaÄÃ­tek. | AF3: TestovacÃ­ reÅ¾im lze zapnout pÅepÃ­naÄem pÅi ÄekÃ¡nÃ­ na novou hru. | AG3: Po vstupu do testovacÃ­ho reÅ¾imu se servo vychÃ½lÃ­ do stÅedovÃ© polohy. | AH3: PÅi zahÃ¡jenÃ­ testovacÃ­ho reÅ¾imu zhasne stÅedovÃ¡ LED na pÃ¡se. | AI3: InformaÄnÃ­ diody v testovacÃ­m reÅ¾imu blikajÃ­. | AJ3: InformaÄnÃ­ diody nejen, Å¾e blikajÃ­, ale navÃ­c v souladu se zadÃ¡nÃ­m svÃ­tÃ­ jako Å¾elezniÄnÃ­ pÅejezd (stÅÃ­dajÃ­ se). | AK3: V testovacÃ­m reÅ¾imu posun potenciometru vlevo vychÃ½lÃ­ ruÄiÄku vlevo. | AL3: V testovacÃ­m reÅ¾imu posun potenciometru vlevo vyvolÃ¡ pohyb rozsvÃ­cenÃ© LED na pÃ¡se vlevo. | AM3: V testovacÃ­m reÅ¾imu posun potenciometru vpravo vychÃ½lÃ­ ruÄiÄku vpravo. | AN3: V testovacÃ­m reÅ¾imu posun potenciometru vpravo vyvolÃ¡ pohyb rozsvÃ­cenÃ© LED na pÃ¡se vpravo. | AO3: V testovacÃ­m reÅ¾imu je v sÃ©riovÃ©m portu je rozsvÃ­ceno "Debug mode". | AP3: V testovacÃ­m reÅ¾imu zaÅÃ­zenÃ­ nereaguje na stisk tlaÄÃ­tek. | AQ3: TestovacÃ­ reÅ¾im lze vypnout pÅepÃ­naÄem. | AR3: Po ukonÄenÃ­ testovacÃ­ho reÅ¾imu pÅechÃ¡zÃ­ zaÅÃ­zenÃ­ do reÅ¾imu "ÄekÃ¡m na hru". | AS3: ZmÄna polohy pÅepÃ­naÄe je bÄhem hry ignorovÃ¡na. | AT3: BÄhem hry je ignorovÃ¡na zmÄna polohy potenciometru. | AU3: PravÃ¡ indikaÄnÃ­ dioda svÃ­tÃ­ vÅ¾dy, kdyÅ¾ je ruÄiÄka vychÃ½lena na stranu pravÃ©ho hrÃ¡Äe. | AV3: Po 10 stisknutÃ­ch na pravÃ© stranÄ je ruÄiÄka v pravÃ© krajnÃ­ poloze. | AW3: Po 10 stisknutÃ­ch na pravÃ© stranÄ svÃ­tÃ­ nejpravÄjÅ¡Ã­ dioda v pÃ¡su. | AX3: SÃ©riovÃ¡ linka zobrazuje uplynulÃ½ poÄet sekund hry. | AY3: Po ukonÄenÃ­ hry pÅechÃ¡zÃ­ zaÅÃ­zenÃ­ do testovacÃ­ho reÅ¾imu; mÃ¡-li v tÃ©to poloze pÅepÃ­naÄ. | AZ3: StÅedovÃ¡ LED pÃ¡su bÄhem hry sprÃ¡vnÄ mÄnÃ­ barvu podle Äasu. | BA3: StÅedovÃ¡ LED pÃ¡su pÅed koncem hry blikÃ¡ ÄervenÄ. | BB3: StÅedovÃ¡ LED pÃ¡su tÄsnÄ pÅed skonÄenÃ­m hry ÄervenÄ svÃ­tÃ­. | BC3: Hra je ukonÄena po vyprÅ¡enÃ­ ÄasovÃ©ho limitu (20 s). | BD3: Po remÃ­ze (stejnÃ½ poÄet stiskÅ¯ na obou stranÃ¡ch) sÃ©riovÃ¡ linka zobrazÃ­ celkovÃ© skore a skore hry. | BE3: SÃ©riovÃ¡ linka v pÅÃ­padÄ remÃ­zy zobrazÃ­ "Game ignored". | BF3: SouÄÃ¡stÃ­ odevzdanÃ© Ãºlohy je i vÃ½vojovÃ½ diagram zachycujÃ­cÃ­ strukturu programu. | BG3: Ve videu je pÅehlednÄ vidÄt zapojenÃ­ kabelÅ¯ a lze poznat detailnÄjÅ¡Ã­ zapojenÃ­. | BH3: Video se netÅese a pÅesnÄ odpovÃ­dÃ¡ pokynÅ¯m testovacÃ­ho scÃ©nÃ¡Åe. | BI3: Video je srozumitelnÄ komentovÃ¡no. | BJ3: Video je maximÃ¡lne v rozliÅ¡enÃ­ FullHD. | BK3: V dokumentaci je popsÃ¡no, co je pÅipojeno na jakÃ©m portu. | BL3: SouÄÃ¡stÃ­ dokumentace je i vÃ½vojovÃ½ diagram. | BM3: KÃ³d obsahuje struÄnÃ© komentÃ¡Åe s vysvÄtlenÃ­m ÃºÄelu u podporogramÅ¯. | BN3: Podprogramy a promÄnnÃ© jsou pojmenovÃ¡ny podle svÃ© funkce a kÃ³d je tÃ­m srozumitenÃ½. | BO3: V dokumentaci je popsÃ¡no, jak je ÅeÅ¡en zÃ¡kmit tlaÄÃ­tek. | BP3: ZÃ¡kmit tlaÄÃ­tek je v kÃ³du oÅ¡etÅen. | BQ3: Pro zpracovÃ¡nÃ­ signÃ¡lu z tlaÄÃ­tek je uÅ¾ito pÅeruÅ¡enÃ­. | BR3: Celkem | BS3: StartovnÃ­ ÄÃ­slo
A4: max | B4: 2 | C4: 1 | D4: 1 | E4: 2 | F4: 1 | G4: 2 | H4: 1 | I4: 1 | J4: 2 | K4: 2 | L4: 2 | M4: 2 | N4: 2 | O4: 1 | P4: 1 | Q4: 3 | R4: 2 | S4: 2 | T4: 2 | U4: 1 | V4: 1 | W4: 2 | X4: 1 | Y4: 1 | Z4: 1 | AA4: 1 | AB4: 1 | AC4: 1 | AD4: 1 | AE4: 2 | AF4: 2 | AG4: 1 | AH4: 1 | AI4: 1 | AJ4: 1 | AK4: 1 | AL4: 1 | AM4: 1 | AN4: 1 | AO4: 1 | AP4: 1 | AQ4: 1 | AR4: 1 | AS4: 1 | AT4: 1 | AU4: 2 | AV4: 1 | AW4: 1 | AX4: 1 | AY4: 1 | AZ4: 2 | BA4: 2 | BB4: 2 | BC4: 2 | BD4: 1 | BE4: 1 | BF4: 3 | BG4: 1 | BH4: 1 | BI4: 1 | BJ4: 1 | BK4: 2 | BL4: 1 | BM4: 1 | BN4: 1 | BO4: 1 | BP4: 3 | BQ4: 2 | BR4: =SUM(RC[-68]:RC[-1]) -> 20 | BS4: max
A5: 1 | BR5: =SUM(RC[-68]:RC[-1]) -> 20 | BS5: 1
A6: 2 | BR6: =SUM(RC[-68]:RC[-1]) -> 20 | BS6: 2
A7: 3 | BR7: =SUM(RC[-68]:RC[-1]) -> 20 | BS7: 3
A8: 4 | BR8: =SUM(RC[-68]:RC[-1]) -> 20 | BS8: 4
A9: 5 | BR9: =SUM(RC[-68]:RC[-1]) -> 20 | BS9: 5
A10: 6 | BR10: =SUM(RC[-68]:RC[-1]) -> 20 | BS10: 6
A11: 7 | BR11: =SUM(RC[-68]:RC[-1]) -> 20 | BS11: 7
A12: 8 | BR12: =SUM(RC[-68]:RC[-1]) -> 20 | BS12: 8
A13: 9 | BR13: =SUM(RC[-68]:RC[-1]) -> 20 | BS13: 9
A14: 10 | BR14: =SUM(RC[-68]:RC[-1]) -> 20 | BS14: 10
A15: 11 | BR15: =SUM(RC[-68]:RC[-1]) -> 20 | BS15: 11
A16: 12 | BR16: =SUM(RC[-68]:RC[-1]) -> 20 | BS16: 12
A17: 13 | BR17: =SUM(RC[-68]:RC[-1]) -> 20 | BS17: 13
A18: 14 | BR18: =SUM(RC[-68]:RC[-1]) -> 20 | BS18: 14
A19: 15 | BR19: =SUM(RC[-68]:RC[-1]) -> 20 | BS19: 15
A20: 16 | BR20: =SUM(RC[-68]:RC[-1]) -> 20 | BS20: 16
A21: 17 | BR21: =SUM(RC[-68]:RC[-1]) -> 20 | BS21: 17
A22: 18 | BR22: =SUM(RC[-68]:RC[-1]) -> 20 | BS22: 18
A23: 19 | BR23: =SUM(RC[-68]:RC[-1]) -> 20 | BS23: 19
A24: 20 | BR24: =SUM(RC[-68]:RC[-1]) -> 20 | BS24: 20
A25: 21 | BR25: =SUM(RC[-68]:RC[-1]) -> 20 | BS25: 21
A26: 22 | BR26: =SUM(RC[-68]:RC[-1]) -> 20 | BS26: 22
A27: 23 | BR27: =SUM(RC[-68]:RC[-1]) -> 20 | BS27: 23
A28: 24 | BR28: =SUM(RC[-68]:RC[-1]) -> 20 | BS28: 24
A29: 25 | BR29: =SUM(RC[-68]:RC[-1]) -> 20 | BS29: 25
A30: 26 | BR30: =SUM(RC[-68]:RC[-1]) -> 20 | BS30: 26
A31: 27 | BR31: =SUM(RC[-68]:RC[-1]) -> 20 | BS31: 27
A32: 28 | BR32: =SUM(RC[-68]:RC[-1]) -> 20 | BS32: 28
A33: 29 | BR33: =SUM(RC[-68]:RC[-1]) -> 20 | BS33: 29
A34: 30 | BR34: =SUM(RC[-68]:RC[-1]) -> 20 | BS34: 30