Sheet: SouÄet bodÅ¯
B2: Ãloha
A3: StartovnÃ­ ÄÃ­slo | B3: 1 | C3: 2 | D3: 3 | E3: 4 | F3: Celkem
A4: koef | B4: 1 | C4: 1 | D4: 2 | E4: 3
A5: 1 | B5: ='Ãloha 1'!RC[11] * R[-1]C -> 2 | C5: ='Ãloha 2'!RC[3] * R[-1]C -> 2 | D5: ='Ãloha 3'!RC[8] * R[-1]C -> 2 | E5: ='Ãloha 4'!RC[8] * R[-1]C -> 2 | F5: =SUM(RC[-4]:RC[-1]) -> 2
A6: 2 | B6: ='Ãloha 1'!RC[11] * R[-2]C -> 2 | C6: ='Ãloha 2'!RC[3] * R[-2]C -> 2 | D6: ='Ãloha 3'!RC[8] * R[-2]C -> 2 | E6: ='Ãloha 4'!RC[8] * R[-2]C -> 2 | F6: =SUM(RC[-4]:RC[-1]) -> 2
A7: 3 | B7: ='Ãloha 1'!RC[11] * R[-3]C -> 2 | C7: ='Ãloha 2'!RC[3] * R[-3]C -> 2 | D7: ='Ãloha 3'!RC[8] * R[-3]C -> 2 | E7: ='Ãloha 4'!RC[8] * R[-3]C -> 2 | F7: =SUM(RC[-4]:RC[-1]) -> 2
A8: 4 | B8: ='Ãloha 1'!RC[11] * R[-4]C -> 2 | C8: ='Ãloha 2'!RC[3] * R[-4]C -> 2 | D8: ='Ãloha 3'!RC[8] * R[-4]C -> 2 | E8: ='Ãloha 4'!RC[8] * R[-4]C -> 2 | F8: =SUM(RC[-4]:RC[-1]) -> 2
A9: 5 | B9: ='Ãloha 1'!RC[11] * R[-5]C -> 2 | C9: ='Ãloha 2'!RC[3] * R[-5]C -> 2 | D9: ='Ãloha 3'!RC[8] * R[-5]C -> 2 | E9: ='Ãloha 4'!RC[8] * R[-5]C -> 2 | F9: =SUM(RC[-4]:RC[-1]) -> 2
A10: 6 | B10: ='Ãloha 1'!RC[11] * R[-6]C -> 2 | C10: ='Ãloha 2'!RC[3] * R[-6]C -> 2 | D10: ='Ãloha 3'!RC[8] * R[-6]C -> 2 | E10: ='Ãloha 4'!RC[8] * R[-6]C -> 2 | F10: =SUM(RC[-4]:RC[-1]) -> 2
A11: 7 | B11: ='Ãloha 1'!RC[11] * R[-7]C -> 2 | C11: ='Ãloha 2'!RC[3] * R[-7]C -> 2 | D11: ='Ãloha 3'!RC[8] * R[-7]C -> 2 | E11: ='Ãloha 4'!RC[8] * R[-7]C -> 2 | F11: =SUM(RC[-4]:RC[-1]) -> 2
A12: 8 | B12: ='Ãloha 1'!RC[11] * R[-8]C -> 2 | C12: ='Ãloha 2'!RC[3] * R[-8]C -> 2 | D12: ='Ãloha 3'!RC[8] * R[-8]C -> 2 | E12: ='Ãloha 4'!RC[8] * R[-8]C -> 2 | F12: =SUM(RC[-4]:RC[-1]) -> 2
A13: 9 | B13: ='Ãloha 1'!RC[11] * R[-9]C -> 2 | C13: ='Ãloha 2'!RC[3] * R[-9]C -> 2 | D13: ='Ãloha 3'!RC[8] * R[-9]C -> 2 | E13: ='Ãloha 4'!RC[8] * R[-9]C -> 2 | F13: =SUM(RC[-4]:RC[-1]) -> 2
A14: 10 | B14: ='Ãloha 1'!RC[11] * R[-10]C -> 2 | C14: ='Ãloha 2'!RC[3] * R[-10]C -> 2 | D14: ='Ãloha 3'!RC[8] * R[-10]C -> 2 | E14: ='Ãloha 4'!RC[8] * R[-10]C -> 2 | F14: =SUM(RC[-4]:RC[-1]) -> 2
A15: 11 | B15: ='Ãloha 1'!RC[11] * R[-11]C -> 2 | C15: ='Ãloha 2'!RC[3] * R[-11]C -> 2 | D15: ='Ãloha 3'!RC[8] * R[-11]C -> 2 | E15: ='Ãloha 4'!RC[8] * R[-11]C -> 2 | F15: =SUM(RC[-4]:RC[-1]) -> 2
A16: 12 | B16: ='Ãloha 1'!RC[11] * R[-12]C -> 2 | C16: ='Ãloha 2'!RC[3] * R[-12]C -> 2 | D16: ='Ãloha 3'!RC[8] * R[-12]C -> 2 | E16: ='Ãloha 4'!RC[8] * R[-12]C -> 2 | F16: =SUM(RC[-4]:RC[-1]) -> 2
A17: 13 | B17: ='Ãloha 1'!RC[11] * R[-13]C -> 2 | C17: ='Ãloha 2'!RC[3] * R[-13]C -> 2 | D17: ='Ãloha 3'!RC[8] * R[-13]C -> 2 | E17: ='Ãloha 4'!RC[8] * R[-13]C -> 2 | F17: =SUM(RC[-4]:RC[-1]) -> 2
A18: 14 | B18: ='Ãloha 1'!RC[11] * R[-14]C -> 2 | C18: ='Ãloha 2'!RC[3] * R[-14]C -> 2 | D18: ='Ãloha 3'!RC[8] * R[-14]C -> 2 | E18: ='Ãloha 4'!RC[8] * R[-14]C -> 2 | F18: =SUM(RC[-4]:RC[-1]) -> 2
A19: 15 | B19: ='Ãloha 1'!RC[11] * R[-15]C -> 2 | C19: ='Ãloha 2'!RC[3] * R[-15]C -> 2 | D19: ='Ãloha 3'!RC[8] * R[-15]C -> 2 | E19: ='Ãloha 4'!RC[8] * R[-15]C -> 2 | F19: =SUM(RC[-4]:RC[-1]) -> 2
A20: 16 | B20: ='Ãloha 1'!RC[11] * R[-16]C -> 2 | C20: ='Ãloha 2'!RC[3] * R[-16]C -> 2 | D20: ='Ãloha 3'!RC[8] * R[-16]C -> 2 | E20: ='Ãloha 4'!RC[8] * R[-16]C -> 2 | F20: =SUM(RC[-4]:RC[-1]) -> 2
A21: 17 | B21: ='Ãloha 1'!RC[11] * R[-17]C -> 2 | C21: ='Ãloha 2'!RC[3] * R[-17]C -> 2 | D21: ='Ãloha 3'!RC[8] * R[-17]C -> 2 | E21: ='Ãloha 4'!RC[8] * R[-17]C -> 2 | F21: =SUM(RC[-4]:RC[-1]) -> 2
A22: 18 | B22: ='Ãloha 1'!RC[11] * R[-18]C -> 2 | C22: ='Ãloha 2'!RC[3] * R[-18]C -> 2 | D22: ='Ãloha 3'!RC[8] * R[-18]C -> 2 | E22: ='Ãloha 4'!RC[8] * R[-18]C -> 2 | F22: =SUM(RC[-4]:RC[-1]) -> 2
A23: 19 | B23: ='Ãloha 1'!RC[11] * R[-19]C -> 2 | C23: ='Ãloha 2'!RC[3] * R[-19]C -> 2 | D23: ='Ãloha 3'!RC[8] * R[-19]C -> 2 | E23: ='Ãloha 4'!RC[8] * R[-19]C -> 2 | F23: =SUM(RC[-4]:RC[-1]) -> 2
A24: 20 | B24: ='Ãloha 1'!RC[11] * R[-20]C -> 2 | C24: ='Ãloha 2'!RC[3] * R[-20]C -> 2 | D24: ='Ãloha 3'!RC[8] * R[-20]C -> 2 | E24: ='Ãloha 4'!RC[8] * R[-20]C -> 2 | F24: =SUM(RC[-4]:RC[-1]) -> 2
A25: 21 | B25: ='Ãloha 1'!RC[11] * R[-21]C -> 2 | C25: ='Ãloha 2'!RC[3] * R[-21]C -> 2 | D25: ='Ãloha 3'!RC[8] * R[-21]C -> 2 | E25: ='Ãloha 4'!RC[8] * R[-21]C -> 2 | F25: =SUM(RC[-4]:RC[-1]) -> 2
A26: 22 | B26: ='Ãloha 1'!RC[11] * R[-22]C -> 2 | C26: ='Ãloha 2'!RC[3] * R[-22]C -> 2 | D26: ='Ãloha 3'!RC[8] * R[-22]C -> 2 | E26: ='Ãloha 4'!RC[8] * R[-22]C -> 2 | F26: =SUM(RC[-4]:RC[-1]) -> 2
A27: 23 | B27: ='Ãloha 1'!RC[11] * R[-23]C -> 2 | C27: ='Ãloha 2'!RC[3] * R[-23]C -> 2 | D27: ='Ãloha 3'!RC[8] * R[-23]C -> 2 | E27: ='Ãloha 4'!RC[8] * R[-23]C -> 2 | F27: =SUM(RC[-4]:RC[-1]) -> 2
A28: 24 | B28: ='Ãloha 1'!RC[11] * R[-24]C -> 2 | C28: ='Ãloha 2'!RC[3] * R[-24]C -> 2 | D28: ='Ãloha 3'!RC[8] * R[-24]C -> 2 | E28: ='Ãloha 4'!RC[8] * R[-24]C -> 2 | F28: =SUM(RC[-4]:RC[-1]) -> 2
A29: 25 | B29: ='Ãloha 1'!RC[11] * R[-25]C -> 2 | C29: ='Ãloha 2'!RC[3] * R[-25]C -> 2 | D29: ='Ãloha 3'!RC[8] * R[-25]C -> 2 | E29: ='Ãloha 4'!RC[8] * R[-25]C -> 2 | F29: =SUM(RC[-4]:RC[-1]) -> 2
A30: 26 | B30: ='Ãloha 1'!RC[11] * R[-26]C -> 2 | C30: ='Ãloha 2'!RC[3] * R[-26]C -> 2 | D30: ='Ãloha 3'!RC[8] * R[-26]C -> 2 | E30: ='Ãloha 4'!RC[8] * R[-26]C -> 2 | F30: =SUM(RC[-4]:RC[-1]) -> 2
A31: 27 | B31: ='Ãloha 1'!RC[11] * R[-27]C -> 2 | C31: ='Ãloha 2'!RC[3] * R[-27]C -> 2 | D31: ='Ãloha 3'!RC[8] * R[-27]C -> 2 | E31: ='Ãloha 4'!RC[8] * R[-27]C -> 2 | F31: =SUM(RC[-4]:RC[-1]) -> 2
A32: 28 | B32: ='Ãloha 1'!RC[11] * R[-28]C -> 2 | C32: ='Ãloha 2'!RC[3] * R[-28]C -> 2 | D32: ='Ãloha 3'!RC[8] * R[-28]C -> 2 | E32: ='Ãloha 4'!RC[8] * R[-28]C -> 2 | F32: =SUM(RC[-4]:RC[-1]) -> 2
A33: 29 | B33: ='Ãloha 1'!RC[11] * R[-29]C -> 2 | C33: ='Ãloha 2'!RC[3] * R[-29]C -> 2 | D33: ='Ãloha 3'!RC[8] * R[-29]C -> 2 | E33: ='Ãloha 4'!RC[8] * R[-29]C -> 2 | F33: =SUM(RC[-4]:RC[-1]) -> 2
A34: 30 | B34: ='Ãloha 1'!RC[11] * R[-30]C -> 2 | C34: ='Ãloha 2'!RC[3] * R[-30]C -> 2 | D34: ='Ãloha 3'!RC[8] * R[-30]C -> 2 | E34: ='Ãloha 4'!RC[8] * R[-30]C -> 2 | F34: =SUM(RC[-4]:RC[-1]) -> 2

Sheet: Ãloha 1
A1: HodnocenÃ­ Ãºlohy HrÃ¡tky sÂ ÄÃ­sly
B2: HodnotÃ­cÃ­ kritÃ©ria
A3: StartovnÃ­ ÄÃ­slo | C3: Program lze spustit a ukonÄit zadÃ¡nÃ­m ÄÃ­sla 0. Pokud je nutno pro kaÅ¾dÃ© ÄÃ­slo program znovu startovat tak 0.5 bodu. | D3: N=1, vrÃ¡tÃ­ 1 (z ÄÃ­sla 1) | E3: N= 876543225 vrÃ¡tÃ­ 9 (z ÄÃ­sla 109739370) | F3: N= 200 vrÃ¡tÃ­ 0 (z ÄÃ­sla 103) | G3: N= 788888890 vrÃ¡tÃ­ 1 (z ÄÃ­sla 100000000) | H3: N= 8888888919 vrÃ¡tÃ­ 2 (z ÄÃ­sla 1000000002) | I3: 12349 vrÃ¡tÃ­ 4 (z ÄÃ­sla 3364) | J3: N= 54321 vrÃ¡tÃ­ 3 (z ÄÃ­sla 13086) | K3: N= 327 vrÃ¡tÃ­ 5 (z ÄÃ­sla 145) | L3: Pokud si program na zÃ¡kladÄ N nÄjakÃ½m zpÅ¯sobem spoÄte, na jakÃ©m ÄÃ­sle se nachÃ¡zÃ­, tak jeden bod. Pokud program generuje ÅetÄzec sloÅ¾enÃ½ z posloupnosti ÄÃ­sel a v nÄm pak vybÃ­rÃ¡ vÃ½sledek, tak 0 bodÅ¯. | M3: Celkem | N3: StartovnÃ­ ÄÃ­slo
A4: max | C4: 1 | D4: 1 | E4: 1 | F4: 1 | G4: 1 | H4: 1 | I4: 1 | J4: 1 | K4: 1 | L4: 1 | M4: =SUM(RC[-11]:RC[-1]) -> 20 | N4: max
A5: 1 | M5: =SUM(RC[-11]:RC[-1]) -> 20 | N5: 1
A6: 2 | M6: =SUM(RC[-11]:RC[-1]) -> 20 | N6: 2
A7: 3 | M7: =SUM(RC[-11]:RC[-1]) -> 20 | N7: 3
A8: 4 | M8: =SUM(RC[-11]:RC[-1]) -> 20 | N8: 4
A9: 5 | M9: =SUM(RC[-11]:RC[-1]) -> 20 | N9: 5
A10: 6 | M10: =SUM(RC[-11]:RC[-1]) -> 20 | N10: 6
A11: 7 | M11: =SUM(RC[-11]:RC[-1]) -> 20 | N11: 7
A12: 8 | M12: =SUM(RC[-11]:RC[-1]) -> 20 | N12: 8
A13: 9 | M13: =SUM(RC[-11]:RC[-1]) -> 20 | N13: 9
A14: 10 | M14: =SUM(RC[-11]:RC[-1]) -> 20 | N14: 10
A15: 11 | M15: =SUM(RC[-11]:RC[-1]) -> 20 | N15: 11
A16: 12 | M16: =SUM(RC[-11]:RC[-1]) -> 20 | N16: 12
A17: 13 | M17: =SUM(RC[-11]:RC[-1]) -> 20 | N17: 13
A18: 14 | M18: =SUM(RC[-11]:RC[-1]) -> 20 | N18: 14
A19: 15 | M19: =SUM(RC[-11]:RC[-1]) -> 20 | N19: 15
A20: 16 | M20: =SUM(RC[-11]:RC[-1]) -> 20 | N20: 16
A21: 17 | M21: =SUM(RC[-11]:RC[-1]) -> 20 | N21: 17
A22: 18 | M22: =SUM(RC[-11]:RC[-1]) -> 20 | N22: 18
A23: 19 | M23: =SUM(RC[-11]:RC[-1]) -> 20 | N23: 19
A24: 20 | M24: =SUM(RC[-11]:RC[-1]) -> 20 | N24: 20
A25: 21 | M25: =SUM(RC[-11]:RC[-1]) -> 20 | N25: 21
A26: 22 | M26: =SUM(RC[-11]:RC[-1]) -> 20 | N26: 22
A27: 23 | M27: =SUM(RC[-11]:RC[-1]) -> 20 | N27: 23
A28: 24 | M28: =SUM(RC[-11]:RC[-1]) -> 20 | N28: 24
A29: 25 | M29: =SUM(RC[-11]:RC[-1]) -> 20 | N29: 25
A30: 26 | M30: =SUM(RC[-11]:RC[-1]) -> 20 | N30: 26
A31: 27 | M31: =SUM(RC[-11]:RC[-1]) -> 20 | N31: 27
A32: 28 | M32: =SUM(RC[-11]:RC[-1]) -> 20 | N32: 28
A33: 29 | M33: =SUM(RC[-11]:RC[-1]) -> 20 | N33: 29
A34: 30 | M34: =SUM(RC[-11]:RC[-1]) -> 20 | N34: 30

Sheet: Ãloha 2
A1: HodnocenÃ­ Ãºlohy Semafor
B2: HodnotÃ­cÃ­ kritÃ©ria
A3: StartovnÃ­ ÄÃ­slo | B3: GrafickÃ© vyobrazenÃ­ semaforu odpovÃ­dÃ¡ zadÃ¡nÃ­ | C3: Posloupnost signÃ¡lÅ¯ a jejich ÄasovÃ¡nÃ­ odpovÃ­dÃ¡ zadÃ¡nÃ­ (za kaÅ¾dÃ½ chybnÄ zobrazenÃ½ Äi chybnÄ trvajÃ­cÃ­ stav odeÄÃ­st 1 bod ze tÅÃ­) | D3: StandardnÃ­ chovÃ¡nÃ­ aplikace (napÅ. ve Windows lze s oknem pohybovat Äi aplikaci ukonÄit) | E3: Dokumentace | F3: Celkem | G3: StartovnÃ­ ÄÃ­slo
A4: max | B4: 3 | C4: 3 | D4: 3 | E4: 1 | F4: =SUM(RC[-4]:RC[-1]) -> 20 | G4: max
A5: 1 | F5: =SUM(RC[-4]:RC[-1]) -> 20 | G5: 1
A6: 2 | F6: =SUM(RC[-4]:RC[-1]) -> 20 | G6: 2
A7: 3 | F7: =SUM(RC[-4]:RC[-1]) -> 20 | G7: 3
A8: 4 | F8: =SUM(RC[-4]:RC[-1]) -> 20 | G8: 4
A9: 5 | F9: =SUM(RC[-4]:RC[-1]) -> 20 | G9: 5
A10: 6 | F10: =SUM(RC[-4]:RC[-1]) -> 20 | G10: 6
A11: 7 | F11: =SUM(RC[-4]:RC[-1]) -> 20 | G11: 7
A12: 8 | F12: =SUM(RC[-4]:RC[-1]) -> 20 | G12: 8
A13: 9 | F13: =SUM(RC[-4]:RC[-1]) -> 20 | G13: 9
A14: 10 | F14: =SUM(RC[-4]:RC[-1]) -> 20 | G14: 10
A15: 11 | F15: =SUM(RC[-4]:RC[-1]) -> 20 | G15: 11
A16: 12 | F16: =SUM(RC[-4]:RC[-1]) -> 20 | G16: 12
A17: 13 | F17: =SUM(RC[-4]:RC[-1]) -> 20 | G17: 13
A18: 14 | F18: =SUM(RC[-4]:RC[-1]) -> 20 | G18: 14
A19: 15 | F19: =SUM(RC[-4]:RC[-1]) -> 20 | G19: 15
A20: 16 | F20: =SUM(RC[-4]:RC[-1]) -> 20 | G20: 16
A21: 17 | F21: =SUM(RC[-4]:RC[-1]) -> 20 | G21: 17
A22: 18 | F22: =SUM(RC[-4]:RC[-1]) -> 20 | G22: 18
A23: 19 | F23: =SUM(RC[-4]:RC[-1]) -> 20 | G23: 19
A24: 20 | F24: =SUM(RC[-4]:RC[-1]) -> 20 | G24: 20
A25: 21 | F25: =SUM(RC[-4]:RC[-1]) -> 20 | G25: 21
A26: 22 | F26: =SUM(RC[-4]:RC[-1]) -> 20 | G26: 22
A27: 23 | F27: =SUM(RC[-4]:RC[-1]) -> 20 | G27: 23
A28: 24 | F28: =SUM(RC[-4]:RC[-1]) -> 20 | G28: 24
A29: 25 | F29: =SUM(RC[-4]:RC[-1]) -> 20 | G29: 25
A30: 26 | F30: =SUM(RC[-4]:RC[-1]) -> 20 | G30: 26
A31: 27 | F31: =SUM(RC[-4]:RC[-1]) -> 20 | G31: 27
A32: 28 | F32: =SUM(RC[-4]:RC[-1]) -> 20 | G32: 28
A33: 29 | F33: =SUM(RC[-4]:RC[-1]) -> 20 | G33: 29
A34: 30 | F34: =SUM(RC[-4]:RC[-1]) -> 20 | G34: 30

Sheet: Ãloha 3
A1: HodnocenÃ­ Ãºlohy Hash
B2: HodnotÃ­cÃ­ kritÃ©ria
A3: StartovnÃ­ ÄÃ­slo | B3: Program lze spustit a lze zadat adresÃ¡Å | C3: AdresÃ¡Å lze zadat komfortnÄ | D3: VÃ½stup je ve sprÃ¡vnÃ©m poÅadÃ­ | E3: Soubor 1 mÃ¡ hash "7" | F3: Soubor 2 mÃ¡ hash "6" | G3: Soubor 3 mÃ¡ hash "6" | H3: Soubor 4 mÃ¡ hash "e" | I3: Soubor 5 mÃ¡ hash "3" | J3: Soubor 6 mÃ¡ hash "5" | K3: Dokumentace | L3: Celkem | M3: StartovnÃ­ ÄÃ­slo
A4: max | B4: 1.0 | C4: 1.0 | D4: 1.0 | E4: 1.0 | F4: 1.0 | G4: 1.0 | H4: 1.0 | I4: 1.0 | J4: 1.0 | K4: 1.0 | L4: =SUM(RC[-10]:RC[-1]) -> 20 | M4: max
A5: 1 | L5: =SUM(RC[-10]:RC[-1]) -> 20 | M5: 1
A6: 2 | L6: =SUM(RC[-10]:RC[-1]) -> 20 | M6: 2
A7: 3 | L7: =SUM(RC[-10]:RC[-1]) -> 20 | M7: 3
A8: 4 | L8: =SUM(RC[-10]:RC[-1]) -> 20 | M8: 4
A9: 5 | L9: =SUM(RC[-10]:RC[-1]) -> 20 | M9: 5
A10: 6 | L10: =SUM(RC[-10]:RC[-1]) -> 20 | M10: 6
A11: 7 | L11: =SUM(RC[-10]:RC[-1]) -> 20 | M11: 7
A12: 8 | L12: =SUM(RC[-10]:RC[-1]) -> 20 | M12: 8
A13: 9 | L13: =SUM(RC[-10]:RC[-1]) -> 20 | M13: 9
A14: 10 | L14: =SUM(RC[-10]:RC[-1]) -> 20 | M14: 10
A15: 11 | L15: =SUM(RC[-10]:RC[-1]) -> 20 | M15: 11
A16: 12 | L16: =SUM(RC[-10]:RC[-1]) -> 20 | M16: 12
A17: 13 | L17: =SUM(RC[-10]:RC[-1]) -> 20 | M17: 13
A18: 14 | L18: =SUM(RC[-10]:RC[-1]) -> 20 | M18: 14
A19: 15 | L19: =SUM(RC[-10]:RC[-1]) -> 20 | M19: 15
A20: 16 | L20: =SUM(RC[-10]:RC[-1]) -> 20 | M20: 16
A21: 17 | L21: =SUM(RC[-10]:RC[-1]) -> 20 | M21: 17
A22: 18 | L22: =SUM(RC[-10]:RC[-1]) -> 20 | M22: 18
A23: 19 | L23: =SUM(RC[-10]:RC[-1]) -> 20 | M23: 19
A24: 20 | L24: =SUM(RC[-10]:RC[-1]) -> 20 | M24: 20
A25: 21 | L25: =SUM(RC[-10]:RC[-1]) -> 20 | M25: 21
A26: 22 | L26: =SUM(RC[-10]:RC[-1]) -> 20 | M26: 22
A27: 23 | L27: =SUM(RC[-10]:RC[-1]) -> 20 | M27: 23
A28: 24 | L28: =SUM(RC[-10]:RC[-1]) -> 20 | M28: 24
A29: 25 | L29: =SUM(RC[-10]:RC[-1]) -> 20 | M29: 25
A30: 26 | L30: =SUM(RC[-10]:RC[-1]) -> 20 | M30: 26
A31: 27 | L31: =SUM(RC[-10]:RC[-1]) -> 20 | M31: 27
A32: 28 | L32: =SUM(RC[-10]:RC[-1]) -> 20 | M32: 28
A33: 29 | L33: =SUM(RC[-10]:RC[-1]) -> 20 | M33: 29
A34: 30 | L34: =SUM(RC[-10]:RC[-1]) -> 20 | M34: 30

Sheet: Ãloha 4
A1: HodnocenÃ­ Ãºlohy Hra 2048
B2: HodnotÃ­cÃ­ kritÃ©ria
A3: StartovnÃ­ ÄÃ­slo | B3: Program lze spustit a zobrazÃ­ se hracÃ­ plÃ¡n a vygeneruje prvnÃ­ 2 dlaÅ¾dice | C3: Program lze ovlÃ¡dat pomoc klÃ¡ves | D3: Program lze ovlÃ¡dat pomocÃ­ tlaÄÃ­tek | E3: Program lze ovlÃ¡dat pomocÃ­ myÅ¡i | F3: Program sprÃ¡vnÄ dodrÅ¾uje pravidla posunu dlaÅ¾dic - 4444 - > 0088 | G3: Program sprÃ¡vnÄ a prÅ¯bÄÅ¾nÄ poÄÃ­tÃ¡ skÃ³re | H3: Program animuje posun dlaÅ¾dic | I3: Program umoÅ¾Åuje zapsat do souboru/naÄÃ­st ze souboru aktuÃ¡lnÃ­ stav hry - dle zadanÃ© struktury | J3: Program rozpoznÃ¡ sprÃ¡vnÄ konec hry | K3: Program umoÅ¾Åuje vrÃ¡cenÃ­ 5 tahÅ¯ zpÄt | L3: Program umoÅ¾Åuje pÅehrÃ¡t celou partii hry od zaÄÃ¡tku. | M3: Celkem | N3: StartovnÃ­ ÄÃ­slo
A4: max | B4: 0.5 | C4: 0.5 | D4: 0.5 | E4: 1.0 | F4: 3.0 | G4: 0.5 | H4: 1.0 | I4: 0.5 | J4: 0.5 | K4: 1.0 | L4: 1.0 | M4: =SUM(RC[-11]:RC[-1]) -> 20 | N4: max
A5: 1 | M5: =SUM(RC[-11]:RC[-1]) -> 20 | N5: 1
A6: 2 | M6: =SUM(RC[-11]:RC[-1]) -> 20 | N6: 2
A7: 3 | M7: =SUM(RC[-11]:RC[-1]) -> 20 | N7: 3
A8: 4 | M8: =SUM(RC[-11]:RC[-1]) -> 20 | N8: 4
A9: 5 | M9: =SUM(RC[-11]:RC[-1]) -> 20 | N9: 5
A10: 6 | M10: =SUM(RC[-11]:RC[-1]) -> 20 | N10: 6
A11: 7 | M11: =SUM(RC[-11]:RC[-1]) -> 20 | N11: 7
A12: 8 | M12: =SUM(RC[-11]:RC[-1]) -> 20 | N12: 8
A13: 9 | M13: =SUM(RC[-11]:RC[-1]) -> 20 | N13: 9
A14: 10 | M14: =SUM(RC[-11]:RC[-1]) -> 20 | N14: 10
A15: 11 | M15: =SUM(RC[-11]:RC[-1]) -> 20 | N15: 11
A16: 12 | M16: =SUM(RC[-11]:RC[-1]) -> 20 | N16: 12
A17: 13 | M17: =SUM(RC[-11]:RC[-1]) -> 20 | N17: 13
A18: 14 | M18: =SUM(RC[-11]:RC[-1]) -> 20 | N18: 14
A19: 15 | M19: =SUM(RC[-11]:RC[-1]) -> 20 | N19: 15
A20: 16 | M20: =SUM(RC[-11]:RC[-1]) -> 20 | N20: 16
A21: 17 | M21: =SUM(RC[-11]:RC[-1]) -> 20 | N21: 17
A22: 18 | M22: =SUM(RC[-11]:RC[-1]) -> 20 | N22: 18
A23: 19 | M23: =SUM(RC[-11]:RC[-1]) -> 20 | N23: 19
A24: 20 | M24: =SUM(RC[-11]:RC[-1]) -> 20 | N24: 20
A25: 21 | M25: =SUM(RC[-11]:RC[-1]) -> 20 | N25: 21
A26: 22 | M26: =SUM(RC[-11]:RC[-1]) -> 20 | N26: 22
A27: 23 | M27: =SUM(RC[-11]:RC[-1]) -> 20 | N27: 23
A28: 24 | M28: =SUM(RC[-11]:RC[-1]) -> 20 | N28: 24
A29: 25 | M29: =SUM(RC[-11]:RC[-1]) -> 20 | N29: 25
A30: 26 | M30: =SUM(RC[-11]:RC[-1]) -> 20 | N30: 26
A31: 27 | M31: =SUM(RC[-11]:RC[-1]) -> 20 | N31: 27
A32: 28 | M32: =SUM(RC[-11]:RC[-1]) -> 20 | N32: 28
A33: 29 | M33: =SUM(RC[-11]:RC[-1]) -> 20 | N33: 29
A34: 30 | M34: =SUM(RC[-11]:RC[-1]) -> 20 | N34: 30