Sheet: SouÄet bodÅ¯
B2: Ãloha
A3: StartovnÃ­ ÄÃ­slo | B3: 1 | C3: 2 | D3: Celkem
A4: koef | B4: 1 | C4: 1
A5: 1 | B5: ='Ãloha 1'!RC[4] * R[-1]C -> 2 | C5: ='Ãloha 2'!RC[26] * R[-1]C -> 2 | D5: =SUM(RC[-2]:RC[-1]) -> 2
A6: 2 | B6: ='Ãloha 1'!RC[4] * R[-2]C -> 2 | C6: ='Ãloha 2'!RC[26] * R[-2]C -> 2 | D6: =SUM(RC[-2]:RC[-1]) -> 2
A7: 3 | B7: ='Ãloha 1'!RC[4] * R[-3]C -> 2 | C7: ='Ãloha 2'!RC[26] * R[-3]C -> 2 | D7: =SUM(RC[-2]:RC[-1]) -> 2
A8: 4 | B8: ='Ãloha 1'!RC[4] * R[-4]C -> 2 | C8: ='Ãloha 2'!RC[26] * R[-4]C -> 2 | D8: =SUM(RC[-2]:RC[-1]) -> 2
A9: 5 | B9: ='Ãloha 1'!RC[4] * R[-5]C -> 2 | C9: ='Ãloha 2'!RC[26] * R[-5]C -> 2 | D9: =SUM(RC[-2]:RC[-1]) -> 2
A10: 6 | B10: ='Ãloha 1'!RC[4] * R[-6]C -> 2 | C10: ='Ãloha 2'!RC[26] * R[-6]C -> 2 | D10: =SUM(RC[-2]:RC[-1]) -> 2
A11: 7 | B11: ='Ãloha 1'!RC[4] * R[-7]C -> 2 | C11: ='Ãloha 2'!RC[26] * R[-7]C -> 2 | D11: =SUM(RC[-2]:RC[-1]) -> 2
A12: 8 | B12: ='Ãloha 1'!RC[4] * R[-8]C -> 2 | C12: ='Ãloha 2'!RC[26] * R[-8]C -> 2 | D12: =SUM(RC[-2]:RC[-1]) -> 2
A13: 9 | B13: ='Ãloha 1'!RC[4] * R[-9]C -> 2 | C13: ='Ãloha 2'!RC[26] * R[-9]C -> 2 | D13: =SUM(RC[-2]:RC[-1]) -> 2
A14: 10 | B14: ='Ãloha 1'!RC[4] * R[-10]C -> 2 | C14: ='Ãloha 2'!RC[26] * R[-10]C -> 2 | D14: =SUM(RC[-2]:RC[-1]) -> 2
A15: 11 | B15: ='Ãloha 1'!RC[4] * R[-11]C -> 2 | C15: ='Ãloha 2'!RC[26] * R[-11]C -> 2 | D15: =SUM(RC[-2]:RC[-1]) -> 2
A16: 12 | B16: ='Ãloha 1'!RC[4] * R[-12]C -> 2 | C16: ='Ãloha 2'!RC[26] * R[-12]C -> 2 | D16: =SUM(RC[-2]:RC[-1]) -> 2
A17: 13 | B17: ='Ãloha 1'!RC[4] * R[-13]C -> 2 | C17: ='Ãloha 2'!RC[26] * R[-13]C -> 2 | D17: =SUM(RC[-2]:RC[-1]) -> 2
A18: 14 | B18: ='Ãloha 1'!RC[4] * R[-14]C -> 2 | C18: ='Ãloha 2'!RC[26] * R[-14]C -> 2 | D18: =SUM(RC[-2]:RC[-1]) -> 2
A19: 15 | B19: ='Ãloha 1'!RC[4] * R[-15]C -> 2 | C19: ='Ãloha 2'!RC[26] * R[-15]C -> 2 | D19: =SUM(RC[-2]:RC[-1]) -> 2
A20: 16 | B20: ='Ãloha 1'!RC[4] * R[-16]C -> 2 | C20: ='Ãloha 2'!RC[26] * R[-16]C -> 2 | D20: =SUM(RC[-2]:RC[-1]) -> 2
A21: 17 | B21: ='Ãloha 1'!RC[4] * R[-17]C -> 2 | C21: ='Ãloha 2'!RC[26] * R[-17]C -> 2 | D21: =SUM(RC[-2]:RC[-1]) -> 2
A22: 18 | B22: ='Ãloha 1'!RC[4] * R[-18]C -> 2 | C22: ='Ãloha 2'!RC[26] * R[-18]C -> 2 | D22: =SUM(RC[-2]:RC[-1]) -> 2
A23: 19 | B23: ='Ãloha 1'!RC[4] * R[-19]C -> 2 | C23: ='Ãloha 2'!RC[26] * R[-19]C -> 2 | D23: =SUM(RC[-2]:RC[-1]) -> 2
A24: 20 | B24: ='Ãloha 1'!RC[4] * R[-20]C -> 2 | C24: ='Ãloha 2'!RC[26] * R[-20]C -> 2 | D24: =SUM(RC[-2]:RC[-1]) -> 2
A25: 21 | B25: ='Ãloha 1'!RC[4] * R[-21]C -> 2 | C25: ='Ãloha 2'!RC[26] * R[-21]C -> 2 | D25: =SUM(RC[-2]:RC[-1]) -> 2
A26: 22 | B26: ='Ãloha 1'!RC[4] * R[-22]C -> 2 | C26: ='Ãloha 2'!RC[26] * R[-22]C -> 2 | D26: =SUM(RC[-2]:RC[-1]) -> 2
A27: 23 | B27: ='Ãloha 1'!RC[4] * R[-23]C -> 2 | C27: ='Ãloha 2'!RC[26] * R[-23]C -> 2 | D27: =SUM(RC[-2]:RC[-1]) -> 2
A28: 24 | B28: ='Ãloha 1'!RC[4] * R[-24]C -> 2 | C28: ='Ãloha 2'!RC[26] * R[-24]C -> 2 | D28: =SUM(RC[-2]:RC[-1]) -> 2
A29: 25 | B29: ='Ãloha 1'!RC[4] * R[-25]C -> 2 | C29: ='Ãloha 2'!RC[26] * R[-25]C -> 2 | D29: =SUM(RC[-2]:RC[-1]) -> 2
A30: 26 | B30: ='Ãloha 1'!RC[4] * R[-26]C -> 2 | C30: ='Ãloha 2'!RC[26] * R[-26]C -> 2 | D30: =SUM(RC[-2]:RC[-1]) -> 2
A31: 27 | B31: ='Ãloha 1'!RC[4] * R[-27]C -> 2 | C31: ='Ãloha 2'!RC[26] * R[-27]C -> 2 | D31: =SUM(RC[-2]:RC[-1]) -> 2
A32: 28 | B32: ='Ãloha 1'!RC[4] * R[-28]C -> 2 | C32: ='Ãloha 2'!RC[26] * R[-28]C -> 2 | D32: =SUM(RC[-2]:RC[-1]) -> 2
A33: 29 | B33: ='Ãloha 1'!RC[4] * R[-29]C -> 2 | C33: ='Ãloha 2'!RC[26] * R[-29]C -> 2 | D33: =SUM(RC[-2]:RC[-1]) -> 2
A34: 30 | B34: ='Ãloha 1'!RC[4] * R[-30]C -> 2 | C34: ='Ãloha 2'!RC[26] * R[-30]C -> 2 | D34: =SUM(RC[-2]:RC[-1]) -> 2

Sheet: Ãloha 1
A1: HodnocenÃ­ Ãºlohy Semafor
B2: HodnotÃ­cÃ­ kritÃ©ria
A3: StartovnÃ­ ÄÃ­slo | B3: GrafickÃ© vyobrazenÃ­ semaforu odpovÃ­dÃ¡ zadÃ¡nÃ­ | C3: Semafor zabÃ­rÃ¡ na vÃ½Å¡ku celou plochu okna prohlÃ­Å¾eÄe | D3: PÅi zmÄnÄ velikosti okna prohlÃ­Å¾eÄe se zmÄnÃ­ i velikost semaforu, tak aby opÄt na vÃ½Å¡ku zabÃ­ral celou plochu | E3: Posloupnost signÃ¡lÅ¯ a jejich ÄasovÃ¡nÃ­ odpovÃ­dÃ¡ zadÃ¡nÃ­ (za kaÅ¾dÃ½ chybnÄ zobrazenÃ½ Äi chybnÄ trvajÃ­cÃ­ stav odeÄÃ­st 1 bod ze tÅÃ­) Body neudÄlujte, pokud je pro animaci pouÅ¾it Javascript | F3: Celkem | G3: StartovnÃ­ ÄÃ­slo
A4: max | B4: 1 | C4: 1 | D4: 1 | E4: 3 | F4: =SUM(RC[-4]:RC[-1]) -> 20 | G4: max
A5: 1 | F5: =SUM(RC[-4]:RC[-1]) -> 20 | G5: 1
A6: 2 | F6: =SUM(RC[-4]:RC[-1]) -> 20 | G6: 2
A7: 3 | F7: =SUM(RC[-4]:RC[-1]) -> 20 | G7: 3
A8: 4 | F8: =SUM(RC[-4]:RC[-1]) -> 20 | G8: 4
A9: 5 | F9: =SUM(RC[-4]:RC[-1]) -> 20 | G9: 5
A10: 6 | F10: =SUM(RC[-4]:RC[-1]) -> 20 | G10: 6
A11: 7 | F11: =SUM(RC[-4]:RC[-1]) -> 20 | G11: 7
A12: 8 | F12: =SUM(RC[-4]:RC[-1]) -> 20 | G12: 8
A13: 9 | F13: =SUM(RC[-4]:RC[-1]) -> 20 | G13: 9
A14: 10 | F14: =SUM(RC[-4]:RC[-1]) -> 20 | G14: 10
A15: 11 | F15: =SUM(RC[-4]:RC[-1]) -> 20 | G15: 11
A16: 12 | F16: =SUM(RC[-4]:RC[-1]) -> 20 | G16: 12
A17: 13 | F17: =SUM(RC[-4]:RC[-1]) -> 20 | G17: 13
A18: 14 | F18: =SUM(RC[-4]:RC[-1]) -> 20 | G18: 14
A19: 15 | F19: =SUM(RC[-4]:RC[-1]) -> 20 | G19: 15
A20: 16 | F20: =SUM(RC[-4]:RC[-1]) -> 20 | G20: 16
A21: 17 | F21: =SUM(RC[-4]:RC[-1]) -> 20 | G21: 17
A22: 18 | F22: =SUM(RC[-4]:RC[-1]) -> 20 | G22: 18
A23: 19 | F23: =SUM(RC[-4]:RC[-1]) -> 20 | G23: 19
A24: 20 | F24: =SUM(RC[-4]:RC[-1]) -> 20 | G24: 20
A25: 21 | F25: =SUM(RC[-4]:RC[-1]) -> 20 | G25: 21
A26: 22 | F26: =SUM(RC[-4]:RC[-1]) -> 20 | G26: 22
A27: 23 | F27: =SUM(RC[-4]:RC[-1]) -> 20 | G27: 23
A28: 24 | F28: =SUM(RC[-4]:RC[-1]) -> 20 | G28: 24
A29: 25 | F29: =SUM(RC[-4]:RC[-1]) -> 20 | G29: 25
A30: 26 | F30: =SUM(RC[-4]:RC[-1]) -> 20 | G30: 26
A31: 27 | F31: =SUM(RC[-4]:RC[-1]) -> 20 | G31: 27
A32: 28 | F32: =SUM(RC[-4]:RC[-1]) -> 20 | G32: 28
A33: 29 | F33: =SUM(RC[-4]:RC[-1]) -> 20 | G33: 29
A34: 30 | F34: =SUM(RC[-4]:RC[-1]) -> 20 | G34: 30

Sheet: Ãloha 2
A1: HodnocenÃ­ Ãºlohy Hra 2048
B2: HodnotÃ­cÃ­ kritÃ©ria
A3: StartovnÃ­ ÄÃ­slo | B3: StrÃ¡nka obsahuje hernÃ­ plÃ¡n 4Ã4 | C3: StrÃ¡nka obsahuje ovlÃ¡dacÃ­ tlaÄÃ­tka | D3: StrÃ¡nka obsahuje tabulku s deseti nejlepÅ¡Ã­mi vÃ½sledky a je v nÃ­ nÄco vyplnÄno | E3: StrÃ¡nka je responzivnÃ­ a na uÅ¾Å¡Ã­ch displejÃ­ch se tabulka s vÃ½sledky pÅesune na konec strÃ¡nky | F3: StrÃ¡nka je responzivnÃ­ a na uÅ¾Å¡Ã­ch displejÃ­ch zabÃ­rÃ¡ hracÃ­ plÃ¡n 4Ã4 celou Å¡Ã­Åku okna prohlÃ­Å¾eÄe | G3: Na zaÄÃ¡tku hry se sprÃ¡vnÄ vygenerujÃ­ prvnÃ­ dvÄ dlaÅ¾dice | H3: Program lze ovlÃ¡dat pomocÃ­ klÃ¡vesovÃ½ch Å¡ipek | I3: Program lze ovlÃ¡dat pomocÃ­ tlaÄÃ­tek na strÃ¡nce | J3: Program lze ovlÃ¡dat pomocÃ­ myÅ¡i | K3: Program lze ovlÃ¡dat taÅ¾enÃ­m prstu (lze testovat pomocÃ­ Device Toolbaru ve vÃ½vojÃ¡ÅskÃ½ch nÃ¡strojÃ­ch, stisknutÃ¡ myÅ¡ se pak chovÃ¡ jako prst) | L3: Program sprÃ¡vnÄ dodrÅ¾uje pravidla posunu dlaÅ¾dic (napÅ. 4444 -> 0088), za kaÅ¾dou zjiÅ¡tÄnou anomÃ¡lii strnÄte jeden bod | M3: Program sprÃ¡vnÄ a prÅ¯bÄÅ¾nÄ poÄÃ­tÃ¡ a zobrazuje skÃ³re | N3: DlaÅ¾dice se pÅi posunu animujÃ­ | O3: DlaÅ¾dice se pÅi slouÄenÃ­ animujÃ­ | P3: Program rozpoznÃ¡ sprÃ¡vnÄ konec hry a zobrazÃ­ o tom informaci | Q3: Po skonÄenÃ­ hry se aktualizuje nejvyÅ¡Å¡Ã­ dosaÅ¾enÃ© skÃ³re | R3: Po skonÄenÃ­ hry se aktualizuje tabulka s vÃ½sledky | S3: Do tabulky s vÃ½sledky se zapisuje jmÃ©no zadanÃ© do vstupnÃ­ho pole na strÃ¡nce | T3: Program umoÅ¾Åuje vrÃ¡cenÃ­ libobolnÃ©ho poÄtu tahÅ¯ zpÄt | U3: Stiskem tlaÄÃ­tka lze zahÃ¡jit novou hru po skonÄenÃ­ pÅedchozÃ­ | V3: Stiskem tlaÄÃ­tka lze zahÃ¡jit novou hru kdykoliv bÄhem tÃ© souÄasnÃ© a neaktualizujÃ­ se pÅitom nejlepÅ¡Ã­ vÃ½sledek a tabulka s vÃ½sledky | W3: Program umoÅ¾Åuje pÅehrÃ¡t partii hry od zaÄÃ¡tku | X3: PÅi pÅehrÃ¡vÃ¡nÃ­ lze mÄnit dÃ©lku pauzy mezi tahy | Y3: Funkci pÅehrÃ¡nÃ­ lze vyvolat i bÄhem rozehranÃ© hry | Z3: NejvyÅ¡Å¡Ã­ dosaÅ¾enÃ© skÃ³re si strÃ¡nka pamatuje i po restartu prohlÃ­Å¾eÄe. | AA3: Tabulku s vÃ½sledky si strÃ¡nka pamatuje i po restartu prohlÃ­Å¾eÄe. | AB3: Lze pÅehrÃ¡t i libovolnou hru z tabulky vÃ½sledkÅ¯ | AC3: Celkem | AD3: StartovnÃ­ ÄÃ­slo
A4: max | B4: 1 | C4: 1 | D4: 1 | E4: 1 | F4: 1 | G4: 1 | H4: 1 | I4: 1 | J4: 1 | K4: 1 | L4: 5 | M4: 1 | N4: 1 | O4: 1 | P4: 1 | Q4: 1 | R4: 2 | S4: 1 | T4: 5 | U4: 1 | V4: 1 | W4: 2 | X4: 1 | Y4: 1 | Z4: 1 | AA4: 4 | AB4: 1 | AC4: =SUM(RC[-27]:RC[-1]) -> 20 | AD4: max
A5: 1 | AC5: =SUM(RC[-27]:RC[-1]) -> 20 | AD5: 1
A6: 2 | AC6: =SUM(RC[-27]:RC[-1]) -> 20 | AD6: 2
A7: 3 | AC7: =SUM(RC[-27]:RC[-1]) -> 20 | AD7: 3
A8: 4 | AC8: =SUM(RC[-27]:RC[-1]) -> 20 | AD8: 4
A9: 5 | AC9: =SUM(RC[-27]:RC[-1]) -> 20 | AD9: 5
A10: 6 | AC10: =SUM(RC[-27]:RC[-1]) -> 20 | AD10: 6
A11: 7 | AC11: =SUM(RC[-27]:RC[-1]) -> 20 | AD11: 7
A12: 8 | AC12: =SUM(RC[-27]:RC[-1]) -> 20 | AD12: 8
A13: 9 | AC13: =SUM(RC[-27]:RC[-1]) -> 20 | AD13: 9
A14: 10 | AC14: =SUM(RC[-27]:RC[-1]) -> 20 | AD14: 10
A15: 11 | AC15: =SUM(RC[-27]:RC[-1]) -> 20 | AD15: 11
A16: 12 | AC16: =SUM(RC[-27]:RC[-1]) -> 20 | AD16: 12
A17: 13 | AC17: =SUM(RC[-27]:RC[-1]) -> 20 | AD17: 13
A18: 14 | AC18: =SUM(RC[-27]:RC[-1]) -> 20 | AD18: 14
A19: 15 | AC19: =SUM(RC[-27]:RC[-1]) -> 20 | AD19: 15
A20: 16 | AC20: =SUM(RC[-27]:RC[-1]) -> 20 | AD20: 16
A21: 17 | AC21: =SUM(RC[-27]:RC[-1]) -> 20 | AD21: 17
A22: 18 | AC22: =SUM(RC[-27]:RC[-1]) -> 20 | AD22: 18
A23: 19 | AC23: =SUM(RC[-27]:RC[-1]) -> 20 | AD23: 19
A24: 20 | AC24: =SUM(RC[-27]:RC[-1]) -> 20 | AD24: 20
A25: 21 | AC25: =SUM(RC[-27]:RC[-1]) -> 20 | AD25: 21
A26: 22 | AC26: =SUM(RC[-27]:RC[-1]) -> 20 | AD26: 22
A27: 23 | AC27: =SUM(RC[-27]:RC[-1]) -> 20 | AD27: 23
A28: 24 | AC28: =SUM(RC[-27]:RC[-1]) -> 20 | AD28: 24
A29: 25 | AC29: =SUM(RC[-27]:RC[-1]) -> 20 | AD29: 25
A30: 26 | AC30: =SUM(RC[-27]:RC[-1]) -> 20 | AD30: 26
A31: 27 | AC31: =SUM(RC[-27]:RC[-1]) -> 20 | AD31: 27
A32: 28 | AC32: =SUM(RC[-27]:RC[-1]) -> 20 | AD32: 28
A33: 29 | AC33: =SUM(RC[-27]:RC[-1]) -> 20 | AD33: 29
A34: 30 | AC34: =SUM(RC[-27]:RC[-1]) -> 20 | AD34: 30