Sheet: SouÄet bodÅ¯
B2: Ãloha
A3: StartovnÃ­ ÄÃ­slo | B3: 1 | C3: 2 | D3: 3 | E3: 4 | F3: 5 | G3: Celkem
A4: koef | B4: 1 | C4: 1 | D4: 2 | E4: 2 | F4: 3
A5: 1 | B5: ='Ãloha 1'!RC[10] * R[-1]C -> 2 | C5: ='Ãloha 2'!RC[12] * R[-1]C -> 2 | D5: ='Ãloha 3'!RC[4] * R[-1]C -> 2 | E5: ='Ãloha 4'!RC[11] * R[-1]C -> 2 | F5: ='Ãloha 5'!RC[3] * R[-1]C -> 2 | G5: =SUM(RC[-5]:RC[-1]) -> 2
A6: 2 | B6: ='Ãloha 1'!RC[10] * R[-2]C -> 2 | C6: ='Ãloha 2'!RC[12] * R[-2]C -> 2 | D6: ='Ãloha 3'!RC[4] * R[-2]C -> 2 | E6: ='Ãloha 4'!RC[11] * R[-2]C -> 2 | F6: ='Ãloha 5'!RC[3] * R[-2]C -> 2 | G6: =SUM(RC[-5]:RC[-1]) -> 2
A7: 3 | B7: ='Ãloha 1'!RC[10] * R[-3]C -> 2 | C7: ='Ãloha 2'!RC[12] * R[-3]C -> 2 | D7: ='Ãloha 3'!RC[4] * R[-3]C -> 2 | E7: ='Ãloha 4'!RC[11] * R[-3]C -> 2 | F7: ='Ãloha 5'!RC[3] * R[-3]C -> 2 | G7: =SUM(RC[-5]:RC[-1]) -> 2
A8: 4 | B8: ='Ãloha 1'!RC[10] * R[-4]C -> 2 | C8: ='Ãloha 2'!RC[12] * R[-4]C -> 2 | D8: ='Ãloha 3'!RC[4] * R[-4]C -> 2 | E8: ='Ãloha 4'!RC[11] * R[-4]C -> 2 | F8: ='Ãloha 5'!RC[3] * R[-4]C -> 2 | G8: =SUM(RC[-5]:RC[-1]) -> 2
A9: 5 | B9: ='Ãloha 1'!RC[10] * R[-5]C -> 2 | C9: ='Ãloha 2'!RC[12] * R[-5]C -> 2 | D9: ='Ãloha 3'!RC[4] * R[-5]C -> 2 | E9: ='Ãloha 4'!RC[11] * R[-5]C -> 2 | F9: ='Ãloha 5'!RC[3] * R[-5]C -> 2 | G9: =SUM(RC[-5]:RC[-1]) -> 2
A10: 6 | B10: ='Ãloha 1'!RC[10] * R[-6]C -> 2 | C10: ='Ãloha 2'!RC[12] * R[-6]C -> 2 | D10: ='Ãloha 3'!RC[4] * R[-6]C -> 2 | E10: ='Ãloha 4'!RC[11] * R[-6]C -> 2 | F10: ='Ãloha 5'!RC[3] * R[-6]C -> 2 | G10: =SUM(RC[-5]:RC[-1]) -> 2
A11: 7 | B11: ='Ãloha 1'!RC[10] * R[-7]C -> 2 | C11: ='Ãloha 2'!RC[12] * R[-7]C -> 2 | D11: ='Ãloha 3'!RC[4] * R[-7]C -> 2 | E11: ='Ãloha 4'!RC[11] * R[-7]C -> 2 | F11: ='Ãloha 5'!RC[3] * R[-7]C -> 2 | G11: =SUM(RC[-5]:RC[-1]) -> 2
A12: 8 | B12: ='Ãloha 1'!RC[10] * R[-8]C -> 2 | C12: ='Ãloha 2'!RC[12] * R[-8]C -> 2 | D12: ='Ãloha 3'!RC[4] * R[-8]C -> 2 | E12: ='Ãloha 4'!RC[11] * R[-8]C -> 2 | F12: ='Ãloha 5'!RC[3] * R[-8]C -> 2 | G12: =SUM(RC[-5]:RC[-1]) -> 2
A13: 9 | B13: ='Ãloha 1'!RC[10] * R[-9]C -> 2 | C13: ='Ãloha 2'!RC[12] * R[-9]C -> 2 | D13: ='Ãloha 3'!RC[4] * R[-9]C -> 2 | E13: ='Ãloha 4'!RC[11] * R[-9]C -> 2 | F13: ='Ãloha 5'!RC[3] * R[-9]C -> 2 | G13: =SUM(RC[-5]:RC[-1]) -> 2
A14: 10 | B14: ='Ãloha 1'!RC[10] * R[-10]C -> 2 | C14: ='Ãloha 2'!RC[12] * R[-10]C -> 2 | D14: ='Ãloha 3'!RC[4] * R[-10]C -> 2 | E14: ='Ãloha 4'!RC[11] * R[-10]C -> 2 | F14: ='Ãloha 5'!RC[3] * R[-10]C -> 2 | G14: =SUM(RC[-5]:RC[-1]) -> 2
A15: 11 | B15: ='Ãloha 1'!RC[10] * R[-11]C -> 2 | C15: ='Ãloha 2'!RC[12] * R[-11]C -> 2 | D15: ='Ãloha 3'!RC[4] * R[-11]C -> 2 | E15: ='Ãloha 4'!RC[11] * R[-11]C -> 2 | F15: ='Ãloha 5'!RC[3] * R[-11]C -> 2 | G15: =SUM(RC[-5]:RC[-1]) -> 2
A16: 12 | B16: ='Ãloha 1'!RC[10] * R[-12]C -> 2 | C16: ='Ãloha 2'!RC[12] * R[-12]C -> 2 | D16: ='Ãloha 3'!RC[4] * R[-12]C -> 2 | E16: ='Ãloha 4'!RC[11] * R[-12]C -> 2 | F16: ='Ãloha 5'!RC[3] * R[-12]C -> 2 | G16: =SUM(RC[-5]:RC[-1]) -> 2
A17: 13 | B17: ='Ãloha 1'!RC[10] * R[-13]C -> 2 | C17: ='Ãloha 2'!RC[12] * R[-13]C -> 2 | D17: ='Ãloha 3'!RC[4] * R[-13]C -> 2 | E17: ='Ãloha 4'!RC[11] * R[-13]C -> 2 | F17: ='Ãloha 5'!RC[3] * R[-13]C -> 2 | G17: =SUM(RC[-5]:RC[-1]) -> 2
A18: 14 | B18: ='Ãloha 1'!RC[10] * R[-14]C -> 2 | C18: ='Ãloha 2'!RC[12] * R[-14]C -> 2 | D18: ='Ãloha 3'!RC[4] * R[-14]C -> 2 | E18: ='Ãloha 4'!RC[11] * R[-14]C -> 2 | F18: ='Ãloha 5'!RC[3] * R[-14]C -> 2 | G18: =SUM(RC[-5]:RC[-1]) -> 2
A19: 15 | B19: ='Ãloha 1'!RC[10] * R[-15]C -> 2 | C19: ='Ãloha 2'!RC[12] * R[-15]C -> 2 | D19: ='Ãloha 3'!RC[4] * R[-15]C -> 2 | E19: ='Ãloha 4'!RC[11] * R[-15]C -> 2 | F19: ='Ãloha 5'!RC[3] * R[-15]C -> 2 | G19: =SUM(RC[-5]:RC[-1]) -> 2
A20: 16 | B20: ='Ãloha 1'!RC[10] * R[-16]C -> 2 | C20: ='Ãloha 2'!RC[12] * R[-16]C -> 2 | D20: ='Ãloha 3'!RC[4] * R[-16]C -> 2 | E20: ='Ãloha 4'!RC[11] * R[-16]C -> 2 | F20: ='Ãloha 5'!RC[3] * R[-16]C -> 2 | G20: =SUM(RC[-5]:RC[-1]) -> 2
A21: 17 | B21: ='Ãloha 1'!RC[10] * R[-17]C -> 2 | C21: ='Ãloha 2'!RC[12] * R[-17]C -> 2 | D21: ='Ãloha 3'!RC[4] * R[-17]C -> 2 | E21: ='Ãloha 4'!RC[11] * R[-17]C -> 2 | F21: ='Ãloha 5'!RC[3] * R[-17]C -> 2 | G21: =SUM(RC[-5]:RC[-1]) -> 2
A22: 18 | B22: ='Ãloha 1'!RC[10] * R[-18]C -> 2 | C22: ='Ãloha 2'!RC[12] * R[-18]C -> 2 | D22: ='Ãloha 3'!RC[4] * R[-18]C -> 2 | E22: ='Ãloha 4'!RC[11] * R[-18]C -> 2 | F22: ='Ãloha 5'!RC[3] * R[-18]C -> 2 | G22: =SUM(RC[-5]:RC[-1]) -> 2
A23: 19 | B23: ='Ãloha 1'!RC[10] * R[-19]C -> 2 | C23: ='Ãloha 2'!RC[12] * R[-19]C -> 2 | D23: ='Ãloha 3'!RC[4] * R[-19]C -> 2 | E23: ='Ãloha 4'!RC[11] * R[-19]C -> 2 | F23: ='Ãloha 5'!RC[3] * R[-19]C -> 2 | G23: =SUM(RC[-5]:RC[-1]) -> 2
A24: 20 | B24: ='Ãloha 1'!RC[10] * R[-20]C -> 2 | C24: ='Ãloha 2'!RC[12] * R[-20]C -> 2 | D24: ='Ãloha 3'!RC[4] * R[-20]C -> 2 | E24: ='Ãloha 4'!RC[11] * R[-20]C -> 2 | F24: ='Ãloha 5'!RC[3] * R[-20]C -> 2 | G24: =SUM(RC[-5]:RC[-1]) -> 2
A25: 21 | B25: ='Ãloha 1'!RC[10] * R[-21]C -> 2 | C25: ='Ãloha 2'!RC[12] * R[-21]C -> 2 | D25: ='Ãloha 3'!RC[4] * R[-21]C -> 2 | E25: ='Ãloha 4'!RC[11] * R[-21]C -> 2 | F25: ='Ãloha 5'!RC[3] * R[-21]C -> 2 | G25: =SUM(RC[-5]:RC[-1]) -> 2
A26: 22 | B26: ='Ãloha 1'!RC[10] * R[-22]C -> 2 | C26: ='Ãloha 2'!RC[12] * R[-22]C -> 2 | D26: ='Ãloha 3'!RC[4] * R[-22]C -> 2 | E26: ='Ãloha 4'!RC[11] * R[-22]C -> 2 | F26: ='Ãloha 5'!RC[3] * R[-22]C -> 2 | G26: =SUM(RC[-5]:RC[-1]) -> 2
A27: 23 | B27: ='Ãloha 1'!RC[10] * R[-23]C -> 2 | C27: ='Ãloha 2'!RC[12] * R[-23]C -> 2 | D27: ='Ãloha 3'!RC[4] * R[-23]C -> 2 | E27: ='Ãloha 4'!RC[11] * R[-23]C -> 2 | F27: ='Ãloha 5'!RC[3] * R[-23]C -> 2 | G27: =SUM(RC[-5]:RC[-1]) -> 2
A28: 24 | B28: ='Ãloha 1'!RC[10] * R[-24]C -> 2 | C28: ='Ãloha 2'!RC[12] * R[-24]C -> 2 | D28: ='Ãloha 3'!RC[4] * R[-24]C -> 2 | E28: ='Ãloha 4'!RC[11] * R[-24]C -> 2 | F28: ='Ãloha 5'!RC[3] * R[-24]C -> 2 | G28: =SUM(RC[-5]:RC[-1]) -> 2
A29: 25 | B29: ='Ãloha 1'!RC[10] * R[-25]C -> 2 | C29: ='Ãloha 2'!RC[12] * R[-25]C -> 2 | D29: ='Ãloha 3'!RC[4] * R[-25]C -> 2 | E29: ='Ãloha 4'!RC[11] * R[-25]C -> 2 | F29: ='Ãloha 5'!RC[3] * R[-25]C -> 2 | G29: =SUM(RC[-5]:RC[-1]) -> 2
A30: 26 | B30: ='Ãloha 1'!RC[10] * R[-26]C -> 2 | C30: ='Ãloha 2'!RC[12] * R[-26]C -> 2 | D30: ='Ãloha 3'!RC[4] * R[-26]C -> 2 | E30: ='Ãloha 4'!RC[11] * R[-26]C -> 2 | F30: ='Ãloha 5'!RC[3] * R[-26]C -> 2 | G30: =SUM(RC[-5]:RC[-1]) -> 2
A31: 27 | B31: ='Ãloha 1'!RC[10] * R[-27]C -> 2 | C31: ='Ãloha 2'!RC[12] * R[-27]C -> 2 | D31: ='Ãloha 3'!RC[4] * R[-27]C -> 2 | E31: ='Ãloha 4'!RC[11] * R[-27]C -> 2 | F31: ='Ãloha 5'!RC[3] * R[-27]C -> 2 | G31: =SUM(RC[-5]:RC[-1]) -> 2
A32: 28 | B32: ='Ãloha 1'!RC[10] * R[-28]C -> 2 | C32: ='Ãloha 2'!RC[12] * R[-28]C -> 2 | D32: ='Ãloha 3'!RC[4] * R[-28]C -> 2 | E32: ='Ãloha 4'!RC[11] * R[-28]C -> 2 | F32: ='Ãloha 5'!RC[3] * R[-28]C -> 2 | G32: =SUM(RC[-5]:RC[-1]) -> 2
A33: 29 | B33: ='Ãloha 1'!RC[10] * R[-29]C -> 2 | C33: ='Ãloha 2'!RC[12] * R[-29]C -> 2 | D33: ='Ãloha 3'!RC[4] * R[-29]C -> 2 | E33: ='Ãloha 4'!RC[11] * R[-29]C -> 2 | F33: ='Ãloha 5'!RC[3] * R[-29]C -> 2 | G33: =SUM(RC[-5]:RC[-1]) -> 2
A34: 30 | B34: ='Ãloha 1'!RC[10] * R[-30]C -> 2 | C34: ='Ãloha 2'!RC[12] * R[-30]C -> 2 | D34: ='Ãloha 3'!RC[4] * R[-30]C -> 2 | E34: ='Ãloha 4'!RC[11] * R[-30]C -> 2 | F34: ='Ãloha 5'!RC[3] * R[-30]C -> 2 | G34: =SUM(RC[-5]:RC[-1]) -> 2

Sheet: Ãloha 1
A1: HodnocenÃ­ Ãºlohy Vlajka
B2: HodnotÃ­cÃ­ kritÃ©ria
A3: StartovnÃ­ ÄÃ­slo | B3: Program nakreslÃ­ vlajku o velikosti 600x400 bodÅ¯ | C3: Program umoÅ¾nÃ­ pozorovat vykreslenÃ­ jednotlivÃ½ch kusÅ¯ vlajky - po stisku ENTER se zobrazÃ­ prvnÃ­ dÃ­l vlajky | D3: Program umoÅ¾nÃ­ pozorovat vykreslenÃ­ jednotlivÃ½ch kusÅ¯ vlajky - po stisku ENTER se zobrazÃ­ druhÃ½ dÃ­l vlajky | E3: Program umoÅ¾nÃ­ pozorovat vykreslenÃ­ jednotlivÃ½ch kusÅ¯ vlajky - po stisku ENTER se zobrazÃ­ tÅetÃ­ dÃ­l vlajky a vlajka je celÃ¡ | F3: Program umoÅ¾nÃ­ mÄnit velikost vlajky - vyberte velikost 900 x 600, vlajka se vykreslÃ­ | G3: Program umoÅ¾nÃ­ mÄnit velikost vlajky - vyberte velikost 1050 x 700, vlajka se vykreslÃ­ | H3: Program umoÅ¾nÃ­ mÄnit velikost vlajky - vyberte velikost 1200 x 800, vlajka se vykreslÃ­ | I3: Program umoÅ¾nÃ­ mÄnit velikost vlajky - zkuste vybrat velikost 1020 x 680, program zadÃ¡nÃ­ odmÃ­tne (neumoÅ¾nÃ­) protoÅ¾e krok nenÃ­ 50 | J3: Program umoÅ¾nÃ­ mÄnit velikost vlajky - zkuste vybrat velikost 1000 x 700, program zadÃ¡nÃ­ odmÃ­tne (neumoÅ¾nÃ­) protoÅ¾e pomÄr nenÃ­ 3:2 | K3: Dokumentace, efektivita, atd. | L3: Celkem | M3: StartovnÃ­ ÄÃ­slo
A4: max | B4: 2 | C4: 1 | D4: 1 | E4: 1 | F4: 1 | G4: 1 | H4: 1 | I4: 0.5 | J4: 0.5 | K4: 1 | L4: =SUM(RC[-10]:RC[-1]) -> 20 | M4: max
A5: 1 | L5: =SUM(RC[-10]:RC[-1]) -> 20 | M5: 1
A6: 2 | L6: =SUM(RC[-10]:RC[-1]) -> 20 | M6: 2
A7: 3 | L7: =SUM(RC[-10]:RC[-1]) -> 20 | M7: 3
A8: 4 | L8: =SUM(RC[-10]:RC[-1]) -> 20 | M8: 4
A9: 5 | L9: =SUM(RC[-10]:RC[-1]) -> 20 | M9: 5
A10: 6 | L10: =SUM(RC[-10]:RC[-1]) -> 20 | M10: 6
A11: 7 | L11: =SUM(RC[-10]:RC[-1]) -> 20 | M11: 7
A12: 8 | L12: =SUM(RC[-10]:RC[-1]) -> 20 | M12: 8
A13: 9 | L13: =SUM(RC[-10]:RC[-1]) -> 20 | M13: 9
A14: 10 | L14: =SUM(RC[-10]:RC[-1]) -> 20 | M14: 10
A15: 11 | L15: =SUM(RC[-10]:RC[-1]) -> 20 | M15: 11
A16: 12 | L16: =SUM(RC[-10]:RC[-1]) -> 20 | M16: 12
A17: 13 | L17: =SUM(RC[-10]:RC[-1]) -> 20 | M17: 13
A18: 14 | L18: =SUM(RC[-10]:RC[-1]) -> 20 | M18: 14
A19: 15 | L19: =SUM(RC[-10]:RC[-1]) -> 20 | M19: 15
A20: 16 | L20: =SUM(RC[-10]:RC[-1]) -> 20 | M20: 16
A21: 17 | L21: =SUM(RC[-10]:RC[-1]) -> 20 | M21: 17
A22: 18 | L22: =SUM(RC[-10]:RC[-1]) -> 20 | M22: 18
A23: 19 | L23: =SUM(RC[-10]:RC[-1]) -> 20 | M23: 19
A24: 20 | L24: =SUM(RC[-10]:RC[-1]) -> 20 | M24: 20
A25: 21 | L25: =SUM(RC[-10]:RC[-1]) -> 20 | M25: 21
A26: 22 | L26: =SUM(RC[-10]:RC[-1]) -> 20 | M26: 22
A27: 23 | L27: =SUM(RC[-10]:RC[-1]) -> 20 | M27: 23
A28: 24 | L28: =SUM(RC[-10]:RC[-1]) -> 20 | M28: 24
A29: 25 | L29: =SUM(RC[-10]:RC[-1]) -> 20 | M29: 25
A30: 26 | L30: =SUM(RC[-10]:RC[-1]) -> 20 | M30: 26
A31: 27 | L31: =SUM(RC[-10]:RC[-1]) -> 20 | M31: 27
A32: 28 | L32: =SUM(RC[-10]:RC[-1]) -> 20 | M32: 28
A33: 29 | L33: =SUM(RC[-10]:RC[-1]) -> 20 | M33: 29
A34: 30 | L34: =SUM(RC[-10]:RC[-1]) -> 20 | M34: 30

Sheet: Ãloha 2
A1: HodnocenÃ­ Ãºlohy ZkouÅ¡enÃ­
B2: HodnotÃ­cÃ­ kritÃ©ria
A3: StartovnÃ­ ÄÃ­slo | B3: Program lze spustit a lze zadat vstupy (parametrem / pomocÃ­ GUI) | C3: Kontrola na vstupy - Vstup 1 - nahlÃ¡sÃ­ chybnÃ½ parametr, popÅ. staÄÃ­ ignorovat chybnÃ½ parametrv GUI nedovolÃ­ zadat jinÃ© hodnoty neÅ¾, kterÃ© jsou povolenÃ©. | D3: Kontrola na vstupy - Vstup 2 - kontrola na numerickou hodnotu poÄtu zkouÅ¡enÃ­v GUI nedovolÃ­ zadat jinÃ© hodnoty neÅ¾, kterÃ© jsou povolenÃ©. | E3: Program navrhne pÅÃ­klady - se sprÃ¡vnÃ½m poÄtem pÅÃ­kladÅ¯ | F3: Program navrhne pÅÃ­klady - ve sprÃ¡vnÃ½ch mezÃ­ch (-99 aÅ¾ 99), vÄetnÄ vÃ½sledkÅ¯ | G3: Program navrhne pÅÃ­klady - aspoÅ jeden pÅÃ­klad s argumenty nebo s vÃ½sledkem v intevalu (-99 aÅ¾ 99) nebo (-0 aÅ¾ 99) | H3: PÅÃ­klady obsahujÃ­ vÅ¡echny specifikovanÃ© matematickÃ© operace | I3: Program umoÅ¾nÃ­ vloÅ¾it (zadat) vÃ½sledky | J3: Program kontroluje vstup numerickÃ½ch hodnot | K3: Program sprÃ¡vnÄ vyhodnotÃ­ test | L3: Program vypÃ­Å¡e chybnÃ© pÅÃ­klady se sprÃ¡vnÃ½m vÃ½sledkem | M3: Dokumentace - zdrojovÃ½ text vykazuje znÃ¡mky komentÃ¡ÅÅ¯, nÃ¡zvy promÄnnÃ½ch indikujÃ­ jejich vÃ½znam | N3: Dokumentace - program obsahuje struÄnÃ½ popis funkce programu a popis vstupnÃ­ch parametrÅ¯ | O3: Celkem | P3: StartovnÃ­ ÄÃ­slo
A4: max | B4: 0.5 | C4: 0.5 | D4: 0.5 | E4: 1 | F4: 1 | G4: 1 | H4: 1 | I4: 1 | J4: 1 | K4: 1 | L4: 0.5 | M4: 0.5 | N4: 0.5 | O4: =SUM(RC[-13]:RC[-1]) -> 20 | P4: max
A5: 1 | O5: =SUM(RC[-13]:RC[-1]) -> 20 | P5: 1
A6: 2 | O6: =SUM(RC[-13]:RC[-1]) -> 20 | P6: 2
A7: 3 | O7: =SUM(RC[-13]:RC[-1]) -> 20 | P7: 3
A8: 4 | O8: =SUM(RC[-13]:RC[-1]) -> 20 | P8: 4
A9: 5 | O9: =SUM(RC[-13]:RC[-1]) -> 20 | P9: 5
A10: 6 | O10: =SUM(RC[-13]:RC[-1]) -> 20 | P10: 6
A11: 7 | O11: =SUM(RC[-13]:RC[-1]) -> 20 | P11: 7
A12: 8 | O12: =SUM(RC[-13]:RC[-1]) -> 20 | P12: 8
A13: 9 | O13: =SUM(RC[-13]:RC[-1]) -> 20 | P13: 9
A14: 10 | O14: =SUM(RC[-13]:RC[-1]) -> 20 | P14: 10
A15: 11 | O15: =SUM(RC[-13]:RC[-1]) -> 20 | P15: 11
A16: 12 | O16: =SUM(RC[-13]:RC[-1]) -> 20 | P16: 12
A17: 13 | O17: =SUM(RC[-13]:RC[-1]) -> 20 | P17: 13
A18: 14 | O18: =SUM(RC[-13]:RC[-1]) -> 20 | P18: 14
A19: 15 | O19: =SUM(RC[-13]:RC[-1]) -> 20 | P19: 15
A20: 16 | O20: =SUM(RC[-13]:RC[-1]) -> 20 | P20: 16
A21: 17 | O21: =SUM(RC[-13]:RC[-1]) -> 20 | P21: 17
A22: 18 | O22: =SUM(RC[-13]:RC[-1]) -> 20 | P22: 18
A23: 19 | O23: =SUM(RC[-13]:RC[-1]) -> 20 | P23: 19
A24: 20 | O24: =SUM(RC[-13]:RC[-1]) -> 20 | P24: 20
A25: 21 | O25: =SUM(RC[-13]:RC[-1]) -> 20 | P25: 21
A26: 22 | O26: =SUM(RC[-13]:RC[-1]) -> 20 | P26: 22
A27: 23 | O27: =SUM(RC[-13]:RC[-1]) -> 20 | P27: 23
A28: 24 | O28: =SUM(RC[-13]:RC[-1]) -> 20 | P28: 24
A29: 25 | O29: =SUM(RC[-13]:RC[-1]) -> 20 | P29: 25
A30: 26 | O30: =SUM(RC[-13]:RC[-1]) -> 20 | P30: 26
A31: 27 | O31: =SUM(RC[-13]:RC[-1]) -> 20 | P31: 27
A32: 28 | O32: =SUM(RC[-13]:RC[-1]) -> 20 | P32: 28
A33: 29 | O33: =SUM(RC[-13]:RC[-1]) -> 20 | P33: 29
A34: 30 | O34: =SUM(RC[-13]:RC[-1]) -> 20 | P34: 30

Sheet: Ãloha 3
A1: HodnocenÃ­ Ãºlohy AnalÃ½za TV logu
B2: HodnotÃ­cÃ­ kritÃ©ria
A3: StartovnÃ­ ÄÃ­slo | B3: program lze spustit, lze mu zadat vstupnÃ­ soubor (gui - dialogem, konzole - poznÃ¡ neexistenci zadanÃ©ho souboru) | C3: zobrazÃ­ âprosledovanÃ©â Äasy za prosinec 2018 ( 243d 17:12:46 - ct1; 128d 19:20:56 - prima; 112d 5:46:51 - cool; â¦ 0d 0:32:44 - csfilm ) [pÅ¯l bodu za kaÅ¾dÃ½ ze ÄtyÅ vÃ½sledkÅ¯] | D3: zobrazÃ­ âunikÃ¡tnÃ­ divÃ¡kyâ za prosinec 2018 ( 733 - ct1; 521 - prima; 453 - cool; â¦ 2 - csfilm ) | E3: najde maximÃ¡lnÃ­ zÃ¡tÄÅ¾ serveru za prosinec 2018 ( 130 - 2018-12-23 21:05 ) | F3: pÅehlednost zobrazenÃ­ vÃ½stupÅ¯ (=nenÃ­ zjevnÄ nepÅehlednÃ© / nemÃ¡ nelogickÃ© ovlÃ¡dÃ¡nÃ­) | G3: dokumentace (pÅehlednost, nÃ¡zvy identifikÃ¡torÅ¯, komentÃ¡Åe) | H3: Celkem | I3: StartovnÃ­ ÄÃ­slo
A4: max | B4: 0.5 | C4: 2 | D4: 2 | E4: 4 | F4: 0.5 | G4: 1 | H4: =SUM(RC[-6]:RC[-1]) -> 20 | I4: max
A5: 1 | H5: =SUM(RC[-6]:RC[-1]) -> 20 | I5: 1
A6: 2 | H6: =SUM(RC[-6]:RC[-1]) -> 20 | I6: 2
A7: 3 | H7: =SUM(RC[-6]:RC[-1]) -> 20 | I7: 3
A8: 4 | H8: =SUM(RC[-6]:RC[-1]) -> 20 | I8: 4
A9: 5 | H9: =SUM(RC[-6]:RC[-1]) -> 20 | I9: 5
A10: 6 | H10: =SUM(RC[-6]:RC[-1]) -> 20 | I10: 6
A11: 7 | H11: =SUM(RC[-6]:RC[-1]) -> 20 | I11: 7
A12: 8 | H12: =SUM(RC[-6]:RC[-1]) -> 20 | I12: 8
A13: 9 | H13: =SUM(RC[-6]:RC[-1]) -> 20 | I13: 9
A14: 10 | H14: =SUM(RC[-6]:RC[-1]) -> 20 | I14: 10
A15: 11 | H15: =SUM(RC[-6]:RC[-1]) -> 20 | I15: 11
A16: 12 | H16: =SUM(RC[-6]:RC[-1]) -> 20 | I16: 12
A17: 13 | H17: =SUM(RC[-6]:RC[-1]) -> 20 | I17: 13
A18: 14 | H18: =SUM(RC[-6]:RC[-1]) -> 20 | I18: 14
A19: 15 | H19: =SUM(RC[-6]:RC[-1]) -> 20 | I19: 15
A20: 16 | H20: =SUM(RC[-6]:RC[-1]) -> 20 | I20: 16
A21: 17 | H21: =SUM(RC[-6]:RC[-1]) -> 20 | I21: 17
A22: 18 | H22: =SUM(RC[-6]:RC[-1]) -> 20 | I22: 18
A23: 19 | H23: =SUM(RC[-6]:RC[-1]) -> 20 | I23: 19
A24: 20 | H24: =SUM(RC[-6]:RC[-1]) -> 20 | I24: 20
A25: 21 | H25: =SUM(RC[-6]:RC[-1]) -> 20 | I25: 21
A26: 22 | H26: =SUM(RC[-6]:RC[-1]) -> 20 | I26: 22
A27: 23 | H27: =SUM(RC[-6]:RC[-1]) -> 20 | I27: 23
A28: 24 | H28: =SUM(RC[-6]:RC[-1]) -> 20 | I28: 24
A29: 25 | H29: =SUM(RC[-6]:RC[-1]) -> 20 | I29: 25
A30: 26 | H30: =SUM(RC[-6]:RC[-1]) -> 20 | I30: 26
A31: 27 | H31: =SUM(RC[-6]:RC[-1]) -> 20 | I31: 27
A32: 28 | H32: =SUM(RC[-6]:RC[-1]) -> 20 | I32: 28
A33: 29 | H33: =SUM(RC[-6]:RC[-1]) -> 20 | I33: 29
A34: 30 | H34: =SUM(RC[-6]:RC[-1]) -> 20 | I34: 30

Sheet: Ãloha 4
A1: HodnocenÃ­ Ãºlohy PrÃ¡ce sÂ mapou
B2: HodnotÃ­cÃ­ kritÃ©ria
A3: StartovnÃ­ ÄÃ­slo | B3: Program lze spustit | C3: Lze zadat vstupnÃ­ soubor | D3: test1.txt ÅÃ¡dek 1 139 44 255 Pa | E3: test1.txt ÅÃ¡dek 2 156 113 250 Rp | F3: test1.txt 1 ÅÃ¡dek 3 243 81 255 Bv | G3: test1.txt 1 ÅÃ¡dek 4 213 224 250 Lk | H3: test1.txt ÅÃ¡dek 5 90 63 240 KH | I3: test2.txt ÅÃ¡dek 1 156 113 250 Rp | J3: test2.txt 2 ÅÃ¡dek 2 213 224 250 Lk | K3: test2.txt 2 ÅÃ¡dek 3 139 44 255 Pa | L3: test2.txt 2 ÅÃ¡dek 4 213 224 250 Lk | M3: test2.txt 2 ÅÃ¡dek 5 243 81 255 Bv | N3: Lze uoÅ¾it vÃ½sledky | O3: Dokumentace | P3: Celkem | Q3: StartovnÃ­ ÄÃ­slo
A4: max | B4: 0.5 | C4: 0.5 | D4: 0.5 | E4: 0.5 | F4: 0.5 | G4: 0.5 | H4: 0.5 | I4: 1.0 | J4: 1.0 | K4: 1.0 | L4: 1.0 | M4: 1.0 | N4: 0.5 | O4: 1.0 | P4: =SUM(RC[-14]:RC[-1]) -> 20 | Q4: max
A5: 1 | P5: =SUM(RC[-14]:RC[-1]) -> 20 | Q5: 1
A6: 2 | P6: =SUM(RC[-14]:RC[-1]) -> 20 | Q6: 2
A7: 3 | P7: =SUM(RC[-14]:RC[-1]) -> 20 | Q7: 3
A8: 4 | P8: =SUM(RC[-14]:RC[-1]) -> 20 | Q8: 4
A9: 5 | P9: =SUM(RC[-14]:RC[-1]) -> 20 | Q9: 5
A10: 6 | P10: =SUM(RC[-14]:RC[-1]) -> 20 | Q10: 6
A11: 7 | P11: =SUM(RC[-14]:RC[-1]) -> 20 | Q11: 7
A12: 8 | P12: =SUM(RC[-14]:RC[-1]) -> 20 | Q12: 8
A13: 9 | P13: =SUM(RC[-14]:RC[-1]) -> 20 | Q13: 9
A14: 10 | P14: =SUM(RC[-14]:RC[-1]) -> 20 | Q14: 10
A15: 11 | P15: =SUM(RC[-14]:RC[-1]) -> 20 | Q15: 11
A16: 12 | P16: =SUM(RC[-14]:RC[-1]) -> 20 | Q16: 12
A17: 13 | P17: =SUM(RC[-14]:RC[-1]) -> 20 | Q17: 13
A18: 14 | P18: =SUM(RC[-14]:RC[-1]) -> 20 | Q18: 14
A19: 15 | P19: =SUM(RC[-14]:RC[-1]) -> 20 | Q19: 15
A20: 16 | P20: =SUM(RC[-14]:RC[-1]) -> 20 | Q20: 16
A21: 17 | P21: =SUM(RC[-14]:RC[-1]) -> 20 | Q21: 17
A22: 18 | P22: =SUM(RC[-14]:RC[-1]) -> 20 | Q22: 18
A23: 19 | P23: =SUM(RC[-14]:RC[-1]) -> 20 | Q23: 19
A24: 20 | P24: =SUM(RC[-14]:RC[-1]) -> 20 | Q24: 20
A25: 21 | P25: =SUM(RC[-14]:RC[-1]) -> 20 | Q25: 21
A26: 22 | P26: =SUM(RC[-14]:RC[-1]) -> 20 | Q26: 22
A27: 23 | P27: =SUM(RC[-14]:RC[-1]) -> 20 | Q27: 23
A28: 24 | P28: =SUM(RC[-14]:RC[-1]) -> 20 | Q28: 24
A29: 25 | P29: =SUM(RC[-14]:RC[-1]) -> 20 | Q29: 25
A30: 26 | P30: =SUM(RC[-14]:RC[-1]) -> 20 | Q30: 26
A31: 27 | P31: =SUM(RC[-14]:RC[-1]) -> 20 | Q31: 27
A32: 28 | P32: =SUM(RC[-14]:RC[-1]) -> 20 | Q32: 28
A33: 29 | P33: =SUM(RC[-14]:RC[-1]) -> 20 | Q33: 29
A34: 30 | P34: =SUM(RC[-14]:RC[-1]) -> 20 | Q34: 30

Sheet: Ãloha 5
A1: HodnocenÃ­ Ãºlohy Otrava Levopisu
B2: HodnotÃ­cÃ­ kritÃ©ria
A3: StartovnÃ­ ÄÃ­slo | B3: Program vÂ limitu vytvoÅÃ­ korektnÃ­ vÃ½stup pro soubor levopis1.txt | C3: Program vÂ limitu vytvoÅÃ­ korektnÃ­ vÃ½stup pro soubor levopis2.txt | D3: Program vÂ limitu vytvoÅÃ­ korektnÃ­ vÃ½stup pro soubor levopis3.txt | E3: Program vÂ limitu vytvoÅÃ­ korektnÃ­ vÃ½stup pro soubor levopis4.txt | F3: Program vÂ limitu vytvoÅÃ­ korektnÃ­ vÃ½stup pro soubor levopis5.txt | G3: Program vÂ limitu vytvoÅÃ­ korektnÃ­ vÃ½stup pro soubor levopis6.txt | H3: Dokumentace, komentÃ¡Åe, pÅehlednost, vÃ½stiÅ¾nÃ© nÃ¡zvy promÄnnÃ½ch, â¦ | I3: Celkem | J3: StartovnÃ­ ÄÃ­slo
A4: max | B4: 1.5 | C4: 1.5 | D4: 1.5 | E4: 1.5 | F4: 1.5 | G4: 1.5 | H4: 1 | I4: =SUM(RC[-7]:RC[-1]) -> 20 | J4: max
A5: 1 | I5: =SUM(RC[-7]:RC[-1]) -> 20 | J5: 1
A6: 2 | I6: =SUM(RC[-7]:RC[-1]) -> 20 | J6: 2
A7: 3 | I7: =SUM(RC[-7]:RC[-1]) -> 20 | J7: 3
A8: 4 | I8: =SUM(RC[-7]:RC[-1]) -> 20 | J8: 4
A9: 5 | I9: =SUM(RC[-7]:RC[-1]) -> 20 | J9: 5
A10: 6 | I10: =SUM(RC[-7]:RC[-1]) -> 20 | J10: 6
A11: 7 | I11: =SUM(RC[-7]:RC[-1]) -> 20 | J11: 7
A12: 8 | I12: =SUM(RC[-7]:RC[-1]) -> 20 | J12: 8
A13: 9 | I13: =SUM(RC[-7]:RC[-1]) -> 20 | J13: 9
A14: 10 | I14: =SUM(RC[-7]:RC[-1]) -> 20 | J14: 10
A15: 11 | I15: =SUM(RC[-7]:RC[-1]) -> 20 | J15: 11
A16: 12 | I16: =SUM(RC[-7]:RC[-1]) -> 20 | J16: 12
A17: 13 | I17: =SUM(RC[-7]:RC[-1]) -> 20 | J17: 13
A18: 14 | I18: =SUM(RC[-7]:RC[-1]) -> 20 | J18: 14
A19: 15 | I19: =SUM(RC[-7]:RC[-1]) -> 20 | J19: 15
A20: 16 | I20: =SUM(RC[-7]:RC[-1]) -> 20 | J20: 16
A21: 17 | I21: =SUM(RC[-7]:RC[-1]) -> 20 | J21: 17
A22: 18 | I22: =SUM(RC[-7]:RC[-1]) -> 20 | J22: 18
A23: 19 | I23: =SUM(RC[-7]:RC[-1]) -> 20 | J23: 19
A24: 20 | I24: =SUM(RC[-7]:RC[-1]) -> 20 | J24: 20
A25: 21 | I25: =SUM(RC[-7]:RC[-1]) -> 20 | J25: 21
A26: 22 | I26: =SUM(RC[-7]:RC[-1]) -> 20 | J26: 22
A27: 23 | I27: =SUM(RC[-7]:RC[-1]) -> 20 | J27: 23
A28: 24 | I28: =SUM(RC[-7]:RC[-1]) -> 20 | J28: 24
A29: 25 | I29: =SUM(RC[-7]:RC[-1]) -> 20 | J29: 25
A30: 26 | I30: =SUM(RC[-7]:RC[-1]) -> 20 | J30: 26
A31: 27 | I31: =SUM(RC[-7]:RC[-1]) -> 20 | J31: 27
A32: 28 | I32: =SUM(RC[-7]:RC[-1]) -> 20 | J32: 28
A33: 29 | I33: =SUM(RC[-7]:RC[-1]) -> 20 | J33: 29
A34: 30 | I34: =SUM(RC[-7]:RC[-1]) -> 20 | J34: 30