Sheet: SouÄet bodÅ¯
B2: Ãloha
A3: StartovnÃ­ ÄÃ­slo | B3: 1 | C3: 2 | D3: Celkem
A4: koef | B4: 1 | C4: 1
A5: 1 | B5: ='Ãloha 1'!RC[19] * R[-1]C -> 2 | C5: ='Ãloha 2'!RC[95] * R[-1]C -> 2 | D5: =SUM(RC[-2]:RC[-1]) -> 2
A6: 2 | B6: ='Ãloha 1'!RC[19] * R[-2]C -> 2 | C6: ='Ãloha 2'!RC[95] * R[-2]C -> 2 | D6: =SUM(RC[-2]:RC[-1]) -> 2
A7: 3 | B7: ='Ãloha 1'!RC[19] * R[-3]C -> 2 | C7: ='Ãloha 2'!RC[95] * R[-3]C -> 2 | D7: =SUM(RC[-2]:RC[-1]) -> 2
A8: 4 | B8: ='Ãloha 1'!RC[19] * R[-4]C -> 2 | C8: ='Ãloha 2'!RC[95] * R[-4]C -> 2 | D8: =SUM(RC[-2]:RC[-1]) -> 2
A9: 5 | B9: ='Ãloha 1'!RC[19] * R[-5]C -> 2 | C9: ='Ãloha 2'!RC[95] * R[-5]C -> 2 | D9: =SUM(RC[-2]:RC[-1]) -> 2
A10: 6 | B10: ='Ãloha 1'!RC[19] * R[-6]C -> 2 | C10: ='Ãloha 2'!RC[95] * R[-6]C -> 2 | D10: =SUM(RC[-2]:RC[-1]) -> 2
A11: 7 | B11: ='Ãloha 1'!RC[19] * R[-7]C -> 2 | C11: ='Ãloha 2'!RC[95] * R[-7]C -> 2 | D11: =SUM(RC[-2]:RC[-1]) -> 2
A12: 8 | B12: ='Ãloha 1'!RC[19] * R[-8]C -> 2 | C12: ='Ãloha 2'!RC[95] * R[-8]C -> 2 | D12: =SUM(RC[-2]:RC[-1]) -> 2
A13: 9 | B13: ='Ãloha 1'!RC[19] * R[-9]C -> 2 | C13: ='Ãloha 2'!RC[95] * R[-9]C -> 2 | D13: =SUM(RC[-2]:RC[-1]) -> 2
A14: 10 | B14: ='Ãloha 1'!RC[19] * R[-10]C -> 2 | C14: ='Ãloha 2'!RC[95] * R[-10]C -> 2 | D14: =SUM(RC[-2]:RC[-1]) -> 2
A15: 11 | B15: ='Ãloha 1'!RC[19] * R[-11]C -> 2 | C15: ='Ãloha 2'!RC[95] * R[-11]C -> 2 | D15: =SUM(RC[-2]:RC[-1]) -> 2
A16: 12 | B16: ='Ãloha 1'!RC[19] * R[-12]C -> 2 | C16: ='Ãloha 2'!RC[95] * R[-12]C -> 2 | D16: =SUM(RC[-2]:RC[-1]) -> 2
A17: 13 | B17: ='Ãloha 1'!RC[19] * R[-13]C -> 2 | C17: ='Ãloha 2'!RC[95] * R[-13]C -> 2 | D17: =SUM(RC[-2]:RC[-1]) -> 2
A18: 14 | B18: ='Ãloha 1'!RC[19] * R[-14]C -> 2 | C18: ='Ãloha 2'!RC[95] * R[-14]C -> 2 | D18: =SUM(RC[-2]:RC[-1]) -> 2
A19: 15 | B19: ='Ãloha 1'!RC[19] * R[-15]C -> 2 | C19: ='Ãloha 2'!RC[95] * R[-15]C -> 2 | D19: =SUM(RC[-2]:RC[-1]) -> 2
A20: 16 | B20: ='Ãloha 1'!RC[19] * R[-16]C -> 2 | C20: ='Ãloha 2'!RC[95] * R[-16]C -> 2 | D20: =SUM(RC[-2]:RC[-1]) -> 2
A21: 17 | B21: ='Ãloha 1'!RC[19] * R[-17]C -> 2 | C21: ='Ãloha 2'!RC[95] * R[-17]C -> 2 | D21: =SUM(RC[-2]:RC[-1]) -> 2
A22: 18 | B22: ='Ãloha 1'!RC[19] * R[-18]C -> 2 | C22: ='Ãloha 2'!RC[95] * R[-18]C -> 2 | D22: =SUM(RC[-2]:RC[-1]) -> 2
A23: 19 | B23: ='Ãloha 1'!RC[19] * R[-19]C -> 2 | C23: ='Ãloha 2'!RC[95] * R[-19]C -> 2 | D23: =SUM(RC[-2]:RC[-1]) -> 2
A24: 20 | B24: ='Ãloha 1'!RC[19] * R[-20]C -> 2 | C24: ='Ãloha 2'!RC[95] * R[-20]C -> 2 | D24: =SUM(RC[-2]:RC[-1]) -> 2
A25: 21 | B25: ='Ãloha 1'!RC[19] * R[-21]C -> 2 | C25: ='Ãloha 2'!RC[95] * R[-21]C -> 2 | D25: =SUM(RC[-2]:RC[-1]) -> 2
A26: 22 | B26: ='Ãloha 1'!RC[19] * R[-22]C -> 2 | C26: ='Ãloha 2'!RC[95] * R[-22]C -> 2 | D26: =SUM(RC[-2]:RC[-1]) -> 2
A27: 23 | B27: ='Ãloha 1'!RC[19] * R[-23]C -> 2 | C27: ='Ãloha 2'!RC[95] * R[-23]C -> 2 | D27: =SUM(RC[-2]:RC[-1]) -> 2
A28: 24 | B28: ='Ãloha 1'!RC[19] * R[-24]C -> 2 | C28: ='Ãloha 2'!RC[95] * R[-24]C -> 2 | D28: =SUM(RC[-2]:RC[-1]) -> 2
A29: 25 | B29: ='Ãloha 1'!RC[19] * R[-25]C -> 2 | C29: ='Ãloha 2'!RC[95] * R[-25]C -> 2 | D29: =SUM(RC[-2]:RC[-1]) -> 2
A30: 26 | B30: ='Ãloha 1'!RC[19] * R[-26]C -> 2 | C30: ='Ãloha 2'!RC[95] * R[-26]C -> 2 | D30: =SUM(RC[-2]:RC[-1]) -> 2
A31: 27 | B31: ='Ãloha 1'!RC[19] * R[-27]C -> 2 | C31: ='Ãloha 2'!RC[95] * R[-27]C -> 2 | D31: =SUM(RC[-2]:RC[-1]) -> 2
A32: 28 | B32: ='Ãloha 1'!RC[19] * R[-28]C -> 2 | C32: ='Ãloha 2'!RC[95] * R[-28]C -> 2 | D32: =SUM(RC[-2]:RC[-1]) -> 2
A33: 29 | B33: ='Ãloha 1'!RC[19] * R[-29]C -> 2 | C33: ='Ãloha 2'!RC[95] * R[-29]C -> 2 | D33: =SUM(RC[-2]:RC[-1]) -> 2
A34: 30 | B34: ='Ãloha 1'!RC[19] * R[-30]C -> 2 | C34: ='Ãloha 2'!RC[95] * R[-30]C -> 2 | D34: =SUM(RC[-2]:RC[-1]) -> 2

Sheet: Ãloha 1
A1: HodnocenÃ­ Ãºlohy ResponzivnÃ­ web
B2: HodnotÃ­cÃ­ kritÃ©ria
A3: StartovnÃ­ ÄÃ­slo | B3: PÅi zmenÅ¡ovÃ¡nÃ­ displeje panel sÂ udÃ¡losmi zmizÃ­ a udÃ¡losti se zobrazÃ­ pod sloÅ¾kami. | C3: PÅi zmenÅ¡ovÃ¡nÃ­ displeje se levÃ½ panel trochu zmÄnÅ¡Ã­. | D3: Pak se pÅi zmenÅ¡ovÃ¡nÃ­ displeje levÃ½ panel zruÅ¡Ã­, udÃ¡losti zmizÃ­ a sloÅ¾ky se budou pÅepÃ­nat nahoÅe. | E3: Panel se sloÅ¾kami je pÅi urÄitÃ© velikosti vÂ horizontÃ¡lnÃ­m mÃ³du - sloÅ¾ky jsou zobrazenÃ© vedle sebe. | F3: Panel se sloÅ¾kami je pÅi urÄitÃ© velikosti zafixovanÃ½ - nezÃ¡visle na skrolovÃ¡nÃ­ je navrchu obrazovky. | G3: KdyÅ¾ se obrazovka dostateÄnÄ zmÄnÅ¡Ã­, tak panel zase pÅestane bÃ½t zafixovanÃ½ nahoÅe. | H3: Do Å¡Ã­Åky cca 300px (to je na zaÄÃ¡tku velikost boÄnÃ­ho panelu) se aplikace vÅ¾dy pÅispÅ¯sobÃ­ velikosti displeje - nenÃ­ vidÄt scrollbar ani nic nepÅetÃ©kÃ¡. | I3: OdesÃ­latel je tuÄnÄ | J3: Pokud je uvedeno iÂ jmÃ©no, tak je adresa odesÃ­latele Å¡edivÃ¡ a ve Å¡piÄatÃ½ch zÃ¡vorkÃ¡ch. | K3: Na malÃ©m displeji emailovÃ¡ adresa zmizÃ­, pokud je zÃ¡roveÅ uvedeno iÂ jmÃ©no odesÃ­latele. | L3: PÅedmÄt je kapitÃ¡lkami. | M3: Äas pÅijetÃ­ zprÃ¡vy a Äas udÃ¡losti je zarovnanÃ½ vpravo nahoÅe. | N3: Äas pÅijetÃ­ zprÃ¡vy a Äas udÃ¡losti je menÅ¡Ã­m pÃ­smem a je Å¡edivÃ½. | O3: UdÃ¡losti se zvÃ½razÅujÃ­ po najetÃ­ myÅ¡Ã­. | P3: PozadÃ­ sloÅ¾ek se zvÃ½razÅuje po najetÃ­ myÅ¡Ã­. | Q3: SloÅ¾ky nejsou vÂ odrÃ¡Å¾kovÃ©m seznamu, ale v "boxech" podobnÄ jako udÃ¡losti a zprÃ¡vy. | R3: SloÅ¾ky jsou oddÄlenÃ© horizontÃ¡lnÃ­ ÄÃ¡rou (oddÄlenÃ© => ÄÃ¡ra nenÃ­ pod poslednÃ­ ani nad prvnÃ­ sloÅ¾kou). | S3: Box sÂ vybranou sloÅ¾kou mÃ¡ modrÃ© pozadÃ­ na celÃ© svojÃ­ ploÅ¡e ploÅ¡e (tedy nemÃ¡ jinÃ© neÅ¾ modrÃ© pozadÃ­) | T3: PÅi urÄitÃ©m zmenÅ¡enÃ­ displeje se pÅedmÄt zprÃ¡vy vÅ¾dycky zaÄne zobrazovat na jinÃ©m ÅÃ¡dku neÅ¾ odesÃ­latel a datum. | U3: Celkem | V3: StartovnÃ­ ÄÃ­slo
A4: max | B4: 3 | C4: 2 | D4: 2 | E4: 1 | F4: 1 | G4: 1 | H4: 5 | I4: 1 | J4: 2 | K4: 1 | L4: 2 | M4: 2 | N4: 1 | O4: 1 | P4: 1 | Q4: 2 | R4: 1 | S4: 1 | T4: 1 | U4: =SUM(RC[-19]:RC[-1]) -> 20 | V4: max
A5: 1 | U5: =SUM(RC[-19]:RC[-1]) -> 20 | V5: 1
A6: 2 | U6: =SUM(RC[-19]:RC[-1]) -> 20 | V6: 2
A7: 3 | U7: =SUM(RC[-19]:RC[-1]) -> 20 | V7: 3
A8: 4 | U8: =SUM(RC[-19]:RC[-1]) -> 20 | V8: 4
A9: 5 | U9: =SUM(RC[-19]:RC[-1]) -> 20 | V9: 5
A10: 6 | U10: =SUM(RC[-19]:RC[-1]) -> 20 | V10: 6
A11: 7 | U11: =SUM(RC[-19]:RC[-1]) -> 20 | V11: 7
A12: 8 | U12: =SUM(RC[-19]:RC[-1]) -> 20 | V12: 8
A13: 9 | U13: =SUM(RC[-19]:RC[-1]) -> 20 | V13: 9
A14: 10 | U14: =SUM(RC[-19]:RC[-1]) -> 20 | V14: 10
A15: 11 | U15: =SUM(RC[-19]:RC[-1]) -> 20 | V15: 11
A16: 12 | U16: =SUM(RC[-19]:RC[-1]) -> 20 | V16: 12
A17: 13 | U17: =SUM(RC[-19]:RC[-1]) -> 20 | V17: 13
A18: 14 | U18: =SUM(RC[-19]:RC[-1]) -> 20 | V18: 14
A19: 15 | U19: =SUM(RC[-19]:RC[-1]) -> 20 | V19: 15
A20: 16 | U20: =SUM(RC[-19]:RC[-1]) -> 20 | V20: 16
A21: 17 | U21: =SUM(RC[-19]:RC[-1]) -> 20 | V21: 17
A22: 18 | U22: =SUM(RC[-19]:RC[-1]) -> 20 | V22: 18
A23: 19 | U23: =SUM(RC[-19]:RC[-1]) -> 20 | V23: 19
A24: 20 | U24: =SUM(RC[-19]:RC[-1]) -> 20 | V24: 20
A25: 21 | U25: =SUM(RC[-19]:RC[-1]) -> 20 | V25: 21
A26: 22 | U26: =SUM(RC[-19]:RC[-1]) -> 20 | V26: 22
A27: 23 | U27: =SUM(RC[-19]:RC[-1]) -> 20 | V27: 23
A28: 24 | U28: =SUM(RC[-19]:RC[-1]) -> 20 | V28: 24
A29: 25 | U29: =SUM(RC[-19]:RC[-1]) -> 20 | V29: 25
A30: 26 | U30: =SUM(RC[-19]:RC[-1]) -> 20 | V30: 26
A31: 27 | U31: =SUM(RC[-19]:RC[-1]) -> 20 | V31: 27
A32: 28 | U32: =SUM(RC[-19]:RC[-1]) -> 20 | V32: 28
A33: 29 | U33: =SUM(RC[-19]:RC[-1]) -> 20 | V33: 29
A34: 30 | U34: =SUM(RC[-19]:RC[-1]) -> 20 | V34: 30

Sheet: Ãloha 2
A1: HodnocenÃ­ Ãºlohy Rodokmen
B2: HodnotÃ­cÃ­ kritÃ©ria
A3: StartovnÃ­ ÄÃ­slo | B3: Nadpis Rodokmen je trvale vÂ levÃ©m hornÃ­m rohu | D3: Bloky majÃ­ zaoblenÃ© rohy | F3: Blok vÅ¾dy obsahuje 3 ÅÃ¡dky sÂ informacemi | H3: Text na 1. ÅÃ¡dku je vÄtÅ¡Ã­ neÅ¾ na zbylÃ½ch 2 | J3: ZemÅelÃ© osoby majÃ­ 2. ÅÃ¡dek rozdÄlenÃ© na dvÄ poloviny (zarovnanÃ© na stÅed) | L3: Datum narozenÃ­ a ÃºmrtÃ­ je doplnÄn oÂ piktogramy | N3: VÅ¡echny osoby vÂ kaÅ¾dÃ© generaci majÃ­ stÅedy ve stejnÃ© vÃ½Å¡ce | P3: ExistujÃ­ ÄÃ¡ry mezi bloky | R3: ÄÃ¡ry jsou lomenÃ© se souosÃ½mi Ãºseky | T3: ÄÃ¡ry neprochÃ¡zÃ­ skrze obdÃ©lnÃ­ky (aÂ ani jimi nejsou pÅekrÃ½vÃ¡ny) | V3: ÄÃ¡ra od dÃ­tÄte kÂ rodiÄi vychÃ¡zÃ­ ze stÅedu hornÃ­ strany obdÃ©lnÃ­ka | X3: ÄÃ¡ra mezi partnery vede mezi stÅedy stran | Z3: ÄÃ¡ra od rodiÄe bez partnera kÂ dÃ­tÄti vede ze stÅedu dolnÃ­ strany | AB3: ÄÃ¡ra pro dÃ­tÄ partnerÅ¯ vychÃ¡zÃ­ ze stÅedu ÄÃ¡ry mezi partnery | AD3: Rodokmen je vykreslen vektorovÄ (ovÄÅte pohledem do kÃ³du) | AF3: JmÃ©na jdou oznaÄit jako text | AH3: Rodokmen lze Å¡kÃ¡lovat prohlÃ­Å¾eÄem bez poruÅ¡enÃ­ ostatnÃ­ch bodÅ¯ hodnocenÃ­ | AJ3: SÂ rodokmenem lze pohybovat pomocÃ­ scrollbarÅ¯ na obrazovce (rodokmen lze ÄÃ¡steÄnÄ vysunout mimo viewport) | AL3: Rodokmen lze posouvat uchopenÃ­m myÅ¡Ã­. | AN3: PÅesun je realizovÃ¡n taÅ¾enÃ­m piktogramu Å¡ipek | AP3: Po kliknutÃ­ na editaÄnÃ­ ikonku se rozdÄlÃ­ obrazovka na dvÄ ÄÃ¡sti | AR3: VÂ pravÃ© polovinÄ je zobrazen dialog pro Ãºpravu, obsahuje prvky zÂ rodokmenu a tlaÄÃ­tko pro zavÅenÃ­ | AT3: OtevÅenÃ­m editaÄnÃ­ho okna se neposune rodokmen | AV3: ZobrazenÃ­ a skrÃ½vÃ¡nÃ­ okna je animovÃ¡no | AX3: Lze upravovat data vÂ rodokmenu skrze okno pro Ãºpravy | AZ3: Upravy se projevujÃ­ ihned | BB3: OvlÃ¡dacÃ­ prvky jsou stylovÃ¡ny dle zadÃ¡nÃ­ | BD3: UpravenÃ¡ data rodokmenu jsou zachovÃ¡na pÅes zavÅenÃ­ okna | BF3: Pohled na rodokmen je zachovÃ¡n pÅes zavÅenÃ­ okna | BH3: ObdelnÃ­ky lze pÅesouvat taÅ¾enÃ­m za Å¡ipku | BJ3: ObdÃ©lnÃ­k po pÅesunu zÅ¯stane na pÅesunutÃ©m mÃ­stÄ | BL3: PÅesouvat lze pouze ve vodorovnÃ©m smÄru | BN3: ÄÃ¡ry se sprÃ¡vnÄ pÅesouvajÃ­ sÂ obdÃ©lnÃ­kem | BP3: Po prvnÃ­m otevÅenÃ­ rodokmenu je zobrazen rÃ¡meÄek pouze pro jednu osobu | BR3: FormulÃ¡Å obsahuje nÄjakÃ¡ tlaÄÃ­tka pro pÅidÃ¡nÃ­ osoby | BT3: TlaÄÃ­tka jsou neaktivnÃ­ dle pravidel vÂ hodnocenÃ­ | BV3: Funguje pÅidÃ¡vÃ¡nÃ­ rodiÄÅ¯ (iÂ opakovanÄ) | BX3: Funguje pÅidÃ¡vÃ¡nÃ­ sourozencÅ¯ (iÂ opakovanÄ) | BZ3: Funguje pÅidÃ¡vÃ¡nÃ­ partnerÅ¯ | CB3: Funguje pÅidÃ¡vÃ¡nÃ­ dÄtÃ­ (iÂ opakovanÄ) | CD3: NovÃ¡ osoba je pÅipojena Äarou dle pravidel ve statickÃ© ÄÃ¡sti | CF3: Po pÅidÃ¡nÃ­ formulÃ¡Å pÅejde kÂ ÃºpravÃ¡m novÄ vzniklÃ© osoby | CH3: Osoby lze smazat (vÂ povolenÃ½ch pÅÃ­padech) | CJ3: Po odstranÄnÃ­ osoba zmizÃ­ a zavÅe se okno pro Ãºpravy | CL3: Lze smazat poÄÃ¡teÄnÃ­ osobu (napÅ. po pÅidÃ¡nÃ­ rodiÄe) | CN3: TlaÄÃ­tko je neaktivnÃ­, pokud osoba nelze odstranit | CP3: Po najetÃ­ na neaktivnÃ­ tlaÄÃ­tka se zobrazÃ­ (sprÃ¡vnÃ½) dÅ¯vod | CR3: OvlÃ¡dacÃ­ prvky jsou stylovÃ¡ny dle zadÃ¡nÃ­ | CT3: Celkem | CU3: StartovnÃ­ ÄÃ­slo
A4: max | B4: 1 | D4: 0.5 | F4: 0.5 | H4: 0.5 | J4: 1 | L4: 0.5 | N4: 1 | P4: 0.5 | R4: 1 | T4: 0.5 | V4: 1 | X4: 1 | Z4: 1 | AB4: 1 | AD4: 1 | AF4: 1 | AH4: 1 | AJ4: 1 | AL4: 2 | AN4: 1 | AP4: 1 | AR4: 1 | AT4: 1 | AV4: 1 | AX4: 2 | AZ4: 1 | BB4: 1 | BD4: 2 | BF4: 2 | BH4: 1 | BJ4: 1 | BL4: 1 | BN4: 2 | BP4: 1 | BR4: 1 | BT4: 1 | BV4: 1 | BX4: 1 | BZ4: 1 | CB4: 1 | CD4: 1 | CF4: 1 | CH4: 1 | CJ4: 1 | CL4: 1 | CN4: 1 | CP4: 1 | CR4: 1 | CT4: =SUM(RC[-96]:RC[-1]) -> 20 | CU4: max
A5: 1 | CT5: =SUM(RC[-96]:RC[-1]) -> 20 | CU5: 1
A6: 2 | CT6: =SUM(RC[-96]:RC[-1]) -> 20 | CU6: 2
A7: 3 | CT7: =SUM(RC[-96]:RC[-1]) -> 20 | CU7: 3
A8: 4 | CT8: =SUM(RC[-96]:RC[-1]) -> 20 | CU8: 4
A9: 5 | CT9: =SUM(RC[-96]:RC[-1]) -> 20 | CU9: 5
A10: 6 | CT10: =SUM(RC[-96]:RC[-1]) -> 20 | CU10: 6
A11: 7 | CT11: =SUM(RC[-96]:RC[-1]) -> 20 | CU11: 7
A12: 8 | CT12: =SUM(RC[-96]:RC[-1]) -> 20 | CU12: 8
A13: 9 | CT13: =SUM(RC[-96]:RC[-1]) -> 20 | CU13: 9
A14: 10 | CT14: =SUM(RC[-96]:RC[-1]) -> 20 | CU14: 10
A15: 11 | CT15: =SUM(RC[-96]:RC[-1]) -> 20 | CU15: 11
A16: 12 | CT16: =SUM(RC[-96]:RC[-1]) -> 20 | CU16: 12
A17: 13 | CT17: =SUM(RC[-96]:RC[-1]) -> 20 | CU17: 13
A18: 14 | CT18: =SUM(RC[-96]:RC[-1]) -> 20 | CU18: 14
A19: 15 | CT19: =SUM(RC[-96]:RC[-1]) -> 20 | CU19: 15
A20: 16 | CT20: =SUM(RC[-96]:RC[-1]) -> 20 | CU20: 16
A21: 17 | CT21: =SUM(RC[-96]:RC[-1]) -> 20 | CU21: 17
A22: 18 | CT22: =SUM(RC[-96]:RC[-1]) -> 20 | CU22: 18
A23: 19 | CT23: =SUM(RC[-96]:RC[-1]) -> 20 | CU23: 19
A24: 20 | CT24: =SUM(RC[-96]:RC[-1]) -> 20 | CU24: 20
A25: 21 | CT25: =SUM(RC[-96]:RC[-1]) -> 20 | CU25: 21
A26: 22 | CT26: =SUM(RC[-96]:RC[-1]) -> 20 | CU26: 22
A27: 23 | CT27: =SUM(RC[-96]:RC[-1]) -> 20 | CU27: 23
A28: 24 | CT28: =SUM(RC[-96]:RC[-1]) -> 20 | CU28: 24
A29: 25 | CT29: =SUM(RC[-96]:RC[-1]) -> 20 | CU29: 25
A30: 26 | CT30: =SUM(RC[-96]:RC[-1]) -> 20 | CU30: 26
A31: 27 | CT31: =SUM(RC[-96]:RC[-1]) -> 20 | CU31: 27
A32: 28 | CT32: =SUM(RC[-96]:RC[-1]) -> 20 | CU32: 28
A33: 29 | CT33: =SUM(RC[-96]:RC[-1]) -> 20 | CU33: 29
A34: 30 | CT34: =SUM(RC[-96]:RC[-1]) -> 20 | CU34: 30