Sheet: SouÄet bodÅ¯
B2: Ãloha
A3: StartovnÃ­ ÄÃ­slo | B3: 1 | C3: 2 | D3: 3 | E3: 4 | F3: Celkem
A4: koef | B4: 1 | C4: 1 | D4: 1 | E4: 1
A5: 1 | B5: ='Ãloha 1'!RC[9] * R[-1]C -> 2 | C5: ='Ãloha 2'!RC[10] * R[-1]C -> 2 | D5: ='Ãloha 3'!RC[11] * R[-1]C -> 2 | E5: ='Ãloha 4'!RC[10] * R[-1]C -> 2 | F5: =SUM(RC[-4]:RC[-1]) -> 2
A6: 2 | B6: ='Ãloha 1'!RC[9] * R[-2]C -> 2 | C6: ='Ãloha 2'!RC[10] * R[-2]C -> 2 | D6: ='Ãloha 3'!RC[11] * R[-2]C -> 2 | E6: ='Ãloha 4'!RC[10] * R[-2]C -> 2 | F6: =SUM(RC[-4]:RC[-1]) -> 2
A7: 3 | B7: ='Ãloha 1'!RC[9] * R[-3]C -> 2 | C7: ='Ãloha 2'!RC[10] * R[-3]C -> 2 | D7: ='Ãloha 3'!RC[11] * R[-3]C -> 2 | E7: ='Ãloha 4'!RC[10] * R[-3]C -> 2 | F7: =SUM(RC[-4]:RC[-1]) -> 2
A8: 4 | B8: ='Ãloha 1'!RC[9] * R[-4]C -> 2 | C8: ='Ãloha 2'!RC[10] * R[-4]C -> 2 | D8: ='Ãloha 3'!RC[11] * R[-4]C -> 2 | E8: ='Ãloha 4'!RC[10] * R[-4]C -> 2 | F8: =SUM(RC[-4]:RC[-1]) -> 2
A9: 5 | B9: ='Ãloha 1'!RC[9] * R[-5]C -> 2 | C9: ='Ãloha 2'!RC[10] * R[-5]C -> 2 | D9: ='Ãloha 3'!RC[11] * R[-5]C -> 2 | E9: ='Ãloha 4'!RC[10] * R[-5]C -> 2 | F9: =SUM(RC[-4]:RC[-1]) -> 2
A10: 6 | B10: ='Ãloha 1'!RC[9] * R[-6]C -> 2 | C10: ='Ãloha 2'!RC[10] * R[-6]C -> 2 | D10: ='Ãloha 3'!RC[11] * R[-6]C -> 2 | E10: ='Ãloha 4'!RC[10] * R[-6]C -> 2 | F10: =SUM(RC[-4]:RC[-1]) -> 2
A11: 7 | B11: ='Ãloha 1'!RC[9] * R[-7]C -> 2 | C11: ='Ãloha 2'!RC[10] * R[-7]C -> 2 | D11: ='Ãloha 3'!RC[11] * R[-7]C -> 2 | E11: ='Ãloha 4'!RC[10] * R[-7]C -> 2 | F11: =SUM(RC[-4]:RC[-1]) -> 2
A12: 8 | B12: ='Ãloha 1'!RC[9] * R[-8]C -> 2 | C12: ='Ãloha 2'!RC[10] * R[-8]C -> 2 | D12: ='Ãloha 3'!RC[11] * R[-8]C -> 2 | E12: ='Ãloha 4'!RC[10] * R[-8]C -> 2 | F12: =SUM(RC[-4]:RC[-1]) -> 2
A13: 9 | B13: ='Ãloha 1'!RC[9] * R[-9]C -> 2 | C13: ='Ãloha 2'!RC[10] * R[-9]C -> 2 | D13: ='Ãloha 3'!RC[11] * R[-9]C -> 2 | E13: ='Ãloha 4'!RC[10] * R[-9]C -> 2 | F13: =SUM(RC[-4]:RC[-1]) -> 2
A14: 10 | B14: ='Ãloha 1'!RC[9] * R[-10]C -> 2 | C14: ='Ãloha 2'!RC[10] * R[-10]C -> 2 | D14: ='Ãloha 3'!RC[11] * R[-10]C -> 2 | E14: ='Ãloha 4'!RC[10] * R[-10]C -> 2 | F14: =SUM(RC[-4]:RC[-1]) -> 2
A15: 11 | B15: ='Ãloha 1'!RC[9] * R[-11]C -> 2 | C15: ='Ãloha 2'!RC[10] * R[-11]C -> 2 | D15: ='Ãloha 3'!RC[11] * R[-11]C -> 2 | E15: ='Ãloha 4'!RC[10] * R[-11]C -> 2 | F15: =SUM(RC[-4]:RC[-1]) -> 2
A16: 12 | B16: ='Ãloha 1'!RC[9] * R[-12]C -> 2 | C16: ='Ãloha 2'!RC[10] * R[-12]C -> 2 | D16: ='Ãloha 3'!RC[11] * R[-12]C -> 2 | E16: ='Ãloha 4'!RC[10] * R[-12]C -> 2 | F16: =SUM(RC[-4]:RC[-1]) -> 2
A17: 13 | B17: ='Ãloha 1'!RC[9] * R[-13]C -> 2 | C17: ='Ãloha 2'!RC[10] * R[-13]C -> 2 | D17: ='Ãloha 3'!RC[11] * R[-13]C -> 2 | E17: ='Ãloha 4'!RC[10] * R[-13]C -> 2 | F17: =SUM(RC[-4]:RC[-1]) -> 2
A18: 14 | B18: ='Ãloha 1'!RC[9] * R[-14]C -> 2 | C18: ='Ãloha 2'!RC[10] * R[-14]C -> 2 | D18: ='Ãloha 3'!RC[11] * R[-14]C -> 2 | E18: ='Ãloha 4'!RC[10] * R[-14]C -> 2 | F18: =SUM(RC[-4]:RC[-1]) -> 2
A19: 15 | B19: ='Ãloha 1'!RC[9] * R[-15]C -> 2 | C19: ='Ãloha 2'!RC[10] * R[-15]C -> 2 | D19: ='Ãloha 3'!RC[11] * R[-15]C -> 2 | E19: ='Ãloha 4'!RC[10] * R[-15]C -> 2 | F19: =SUM(RC[-4]:RC[-1]) -> 2
A20: 16 | B20: ='Ãloha 1'!RC[9] * R[-16]C -> 2 | C20: ='Ãloha 2'!RC[10] * R[-16]C -> 2 | D20: ='Ãloha 3'!RC[11] * R[-16]C -> 2 | E20: ='Ãloha 4'!RC[10] * R[-16]C -> 2 | F20: =SUM(RC[-4]:RC[-1]) -> 2
A21: 17 | B21: ='Ãloha 1'!RC[9] * R[-17]C -> 2 | C21: ='Ãloha 2'!RC[10] * R[-17]C -> 2 | D21: ='Ãloha 3'!RC[11] * R[-17]C -> 2 | E21: ='Ãloha 4'!RC[10] * R[-17]C -> 2 | F21: =SUM(RC[-4]:RC[-1]) -> 2
A22: 18 | B22: ='Ãloha 1'!RC[9] * R[-18]C -> 2 | C22: ='Ãloha 2'!RC[10] * R[-18]C -> 2 | D22: ='Ãloha 3'!RC[11] * R[-18]C -> 2 | E22: ='Ãloha 4'!RC[10] * R[-18]C -> 2 | F22: =SUM(RC[-4]:RC[-1]) -> 2
A23: 19 | B23: ='Ãloha 1'!RC[9] * R[-19]C -> 2 | C23: ='Ãloha 2'!RC[10] * R[-19]C -> 2 | D23: ='Ãloha 3'!RC[11] * R[-19]C -> 2 | E23: ='Ãloha 4'!RC[10] * R[-19]C -> 2 | F23: =SUM(RC[-4]:RC[-1]) -> 2
A24: 20 | B24: ='Ãloha 1'!RC[9] * R[-20]C -> 2 | C24: ='Ãloha 2'!RC[10] * R[-20]C -> 2 | D24: ='Ãloha 3'!RC[11] * R[-20]C -> 2 | E24: ='Ãloha 4'!RC[10] * R[-20]C -> 2 | F24: =SUM(RC[-4]:RC[-1]) -> 2
A25: 21 | B25: ='Ãloha 1'!RC[9] * R[-21]C -> 2 | C25: ='Ãloha 2'!RC[10] * R[-21]C -> 2 | D25: ='Ãloha 3'!RC[11] * R[-21]C -> 2 | E25: ='Ãloha 4'!RC[10] * R[-21]C -> 2 | F25: =SUM(RC[-4]:RC[-1]) -> 2
A26: 22 | B26: ='Ãloha 1'!RC[9] * R[-22]C -> 2 | C26: ='Ãloha 2'!RC[10] * R[-22]C -> 2 | D26: ='Ãloha 3'!RC[11] * R[-22]C -> 2 | E26: ='Ãloha 4'!RC[10] * R[-22]C -> 2 | F26: =SUM(RC[-4]:RC[-1]) -> 2
A27: 23 | B27: ='Ãloha 1'!RC[9] * R[-23]C -> 2 | C27: ='Ãloha 2'!RC[10] * R[-23]C -> 2 | D27: ='Ãloha 3'!RC[11] * R[-23]C -> 2 | E27: ='Ãloha 4'!RC[10] * R[-23]C -> 2 | F27: =SUM(RC[-4]:RC[-1]) -> 2
A28: 24 | B28: ='Ãloha 1'!RC[9] * R[-24]C -> 2 | C28: ='Ãloha 2'!RC[10] * R[-24]C -> 2 | D28: ='Ãloha 3'!RC[11] * R[-24]C -> 2 | E28: ='Ãloha 4'!RC[10] * R[-24]C -> 2 | F28: =SUM(RC[-4]:RC[-1]) -> 2
A29: 25 | B29: ='Ãloha 1'!RC[9] * R[-25]C -> 2 | C29: ='Ãloha 2'!RC[10] * R[-25]C -> 2 | D29: ='Ãloha 3'!RC[11] * R[-25]C -> 2 | E29: ='Ãloha 4'!RC[10] * R[-25]C -> 2 | F29: =SUM(RC[-4]:RC[-1]) -> 2
A30: 26 | B30: ='Ãloha 1'!RC[9] * R[-26]C -> 2 | C30: ='Ãloha 2'!RC[10] * R[-26]C -> 2 | D30: ='Ãloha 3'!RC[11] * R[-26]C -> 2 | E30: ='Ãloha 4'!RC[10] * R[-26]C -> 2 | F30: =SUM(RC[-4]:RC[-1]) -> 2
A31: 27 | B31: ='Ãloha 1'!RC[9] * R[-27]C -> 2 | C31: ='Ãloha 2'!RC[10] * R[-27]C -> 2 | D31: ='Ãloha 3'!RC[11] * R[-27]C -> 2 | E31: ='Ãloha 4'!RC[10] * R[-27]C -> 2 | F31: =SUM(RC[-4]:RC[-1]) -> 2
A32: 28 | B32: ='Ãloha 1'!RC[9] * R[-28]C -> 2 | C32: ='Ãloha 2'!RC[10] * R[-28]C -> 2 | D32: ='Ãloha 3'!RC[11] * R[-28]C -> 2 | E32: ='Ãloha 4'!RC[10] * R[-28]C -> 2 | F32: =SUM(RC[-4]:RC[-1]) -> 2
A33: 29 | B33: ='Ãloha 1'!RC[9] * R[-29]C -> 2 | C33: ='Ãloha 2'!RC[10] * R[-29]C -> 2 | D33: ='Ãloha 3'!RC[11] * R[-29]C -> 2 | E33: ='Ãloha 4'!RC[10] * R[-29]C -> 2 | F33: =SUM(RC[-4]:RC[-1]) -> 2
A34: 30 | B34: ='Ãloha 1'!RC[9] * R[-30]C -> 2 | C34: ='Ãloha 2'!RC[10] * R[-30]C -> 2 | D34: ='Ãloha 3'!RC[11] * R[-30]C -> 2 | E34: ='Ãloha 4'!RC[10] * R[-30]C -> 2 | F34: =SUM(RC[-4]:RC[-1]) -> 2

Sheet: Ãloha 1
A1: HodnocenÃ­ Ãºlohy PÅÃ­prava
B2: HodnotÃ­cÃ­ kritÃ©ria
A3: StartovnÃ­ ÄÃ­slo | B3: ÃÄastnÃ­k nedodal sprÃ¡vnÃ© schÃ©ma nebo vÃ½vojovÃ½ diagram, zaÅÃ­zenÃ­ je nefunkÄnÃ­. | C3: OdevzdanÃ© schÃ©ma je ÃºplnÃ© a sprÃ¡vnÃ©. Pokud schÃ©ma nenÃ­ ÃºplnÄ, ale soutÄÅ¾Ã­cÃ­ alespoÅ nÄco odevzdal, dostane 0,5 bodu. | D3: OdevzdanÃ½ vÃ½vojovÃ½ diagram je ÃºplnÃ½ a sprÃ¡vnÃ½. Pokud vÃ½vojovÃ½ diagram nenÃ­ ÃºplnÃ½, ale soutÄÅ¾Ã­cÃ­ alespoÅ nÄco odevzdal, dostane 0,5 bodu. | E3: Displej je sprÃ¡vnÄ inicializovanÃ½. | F3: Displej na prvnÃ­m ÅÃ¡dku zobrazuje sprÃ¡vnÃ½ text. | G3: Displej na druhÃ©m ÅÃ¡dku zobrazuje sprÃ¡vnÃ© znaky. | H3: Na displeji blikÃ¡ kurzor. | I3: Program pÅechÃ¡zÃ­ do jinÃ© Ãºlohy (bod se udÄlÃ­ pouze v pÅÃ­padÄ, Å¾e ÃºÄastnÃ­k ÅeÅ¡il vÃ­ce jak jednu Ãºlohu) | J3: Dokumentace a pÅehlednost zdrojovÃ©ho kÃ³du. Tento bod je dÄlenÃ½ pÅi dÃ­lÄÃ­m plnÄnÃ­ pÅehlednÃ½ a odsazovanÃ½ zdrojovÃ½ kÃ³d - 0.25 bodu konzistentnÄ a vÃ½stiÅ¾nÄ pojmenovanÃ© promÄnnÃ© - 0.25 bodu komentÃ¡Åe, vysvÄtlujÃ­cÃ­ obtÃ­Å¾nÄjÅ¡Ã­ ÄÃ¡sti kÃ³du - 0.5 bodu | K3: Celkem | L3: StartovnÃ­ ÄÃ­slo
A4: max | B4: 0 | C4: 2 | D4: 2 | E4: 2 | F4: 2 | G4: 3 | H4: 2 | I4: 1 | J4: 1 | K4: =SUM(RC[-9]:RC[-1]) -> 20 | L4: max
A5: 1 | K5: =SUM(RC[-9]:RC[-1]) -> 20 | L5: 1
A6: 2 | K6: =SUM(RC[-9]:RC[-1]) -> 20 | L6: 2
A7: 3 | K7: =SUM(RC[-9]:RC[-1]) -> 20 | L7: 3
A8: 4 | K8: =SUM(RC[-9]:RC[-1]) -> 20 | L8: 4
A9: 5 | K9: =SUM(RC[-9]:RC[-1]) -> 20 | L9: 5
A10: 6 | K10: =SUM(RC[-9]:RC[-1]) -> 20 | L10: 6
A11: 7 | K11: =SUM(RC[-9]:RC[-1]) -> 20 | L11: 7
A12: 8 | K12: =SUM(RC[-9]:RC[-1]) -> 20 | L12: 8
A13: 9 | K13: =SUM(RC[-9]:RC[-1]) -> 20 | L13: 9
A14: 10 | K14: =SUM(RC[-9]:RC[-1]) -> 20 | L14: 10
A15: 11 | K15: =SUM(RC[-9]:RC[-1]) -> 20 | L15: 11
A16: 12 | K16: =SUM(RC[-9]:RC[-1]) -> 20 | L16: 12
A17: 13 | K17: =SUM(RC[-9]:RC[-1]) -> 20 | L17: 13
A18: 14 | K18: =SUM(RC[-9]:RC[-1]) -> 20 | L18: 14
A19: 15 | K19: =SUM(RC[-9]:RC[-1]) -> 20 | L19: 15
A20: 16 | K20: =SUM(RC[-9]:RC[-1]) -> 20 | L20: 16
A21: 17 | K21: =SUM(RC[-9]:RC[-1]) -> 20 | L21: 17
A22: 18 | K22: =SUM(RC[-9]:RC[-1]) -> 20 | L22: 18
A23: 19 | K23: =SUM(RC[-9]:RC[-1]) -> 20 | L23: 19
A24: 20 | K24: =SUM(RC[-9]:RC[-1]) -> 20 | L24: 20
A25: 21 | K25: =SUM(RC[-9]:RC[-1]) -> 20 | L25: 21
A26: 22 | K26: =SUM(RC[-9]:RC[-1]) -> 20 | L26: 22
A27: 23 | K27: =SUM(RC[-9]:RC[-1]) -> 20 | L27: 23
A28: 24 | K28: =SUM(RC[-9]:RC[-1]) -> 20 | L28: 24
A29: 25 | K29: =SUM(RC[-9]:RC[-1]) -> 20 | L29: 25
A30: 26 | K30: =SUM(RC[-9]:RC[-1]) -> 20 | L30: 26
A31: 27 | K31: =SUM(RC[-9]:RC[-1]) -> 20 | L31: 27
A32: 28 | K32: =SUM(RC[-9]:RC[-1]) -> 20 | L32: 28
A33: 29 | K33: =SUM(RC[-9]:RC[-1]) -> 20 | L33: 29
A34: 30 | K34: =SUM(RC[-9]:RC[-1]) -> 20 | L34: 30

Sheet: Ãloha 2
A1: HodnocenÃ­ Ãºlohy HorizontÃ¡lnÃ­ animace textu
B2: HodnotÃ­cÃ­ kritÃ©ria
A3: StartovnÃ­ ÄÃ­slo | B3: ÃÄastnÃ­k nedodal vÃ½vojovÃ½ diagram, program je nefunkÄnÃ­. | C3: OdevzdanÃ½ vÃ½vojovÃ½ diagram je ÃºplnÃ½ a sprÃ¡vnÃ½. Pokud vÃ½vojovÃ½ diagram nenÃ­ ÃºplnÃ½, ale soutÄÅ¾Ã­cÃ­ alespoÅ nÄco odevzdal, dostane 0,5 bodu. | D3: Program pÅechÃ¡zÃ­ do programu HorizontÃ¡lnÃ­ animace textu (body se udÄlÃ­ pouze vÂ pÅÃ­padÄ, Å¾e ÃºÄastnÃ­k ÅeÅ¡il vÃ­ce jak jednu Ãºlohu). | E3: Program staticky zobrazuje text na prvnÃ­m ÅÃ¡dku. | F3: Program staticky zobrazuje text na druhÃ©m ÅÃ¡dku. | G3: Program zajiÅ¡Å¥uje posouvÃ¡nÃ­ textu, ale nesplÅuje zcela zadÃ¡nÃ­. | H3: Program zajiÅ¡Å¥uje posouvÃ¡nÃ­ textu pÅi plnÃ©m splnÄnÃ­ zadÃ¡nÃ­. | I3: PÅi zobrazenÃ­ textu na prvnÃ­m ÅÃ¡dku svÃ­tÃ­ zelenÃ¡ ledka. | J3: PÅi zobrazenÃ­ textu na druhÃ©m ÅÃ¡dku svÃ­tÃ­ Å¾lutÃ¡ ledka. | K3: Program pÅechÃ¡zÃ­ do jinÃ© Ãºlohy (bod se udÄlÃ­ pouze v pÅÃ­padÄ, Å¾e ÃºÄastnÃ­k ÅeÅ¡il vÃ­ce jak jednu Ãºlohu). | L3: Dokumentace a pÅehlednost zdrojovÃ©ho kÃ³du. Tento bod je dÄlenÃ½ pÅi dÃ­lÄÃ­m plnÄnÃ­ pÅehlednÃ½ a odsazovanÃ½ zdrojovÃ½ kÃ³d - 0.25 bodu konzistentnÄ a vÃ½stiÅ¾nÄ pojmenovanÃ© promÄnnÃ© - 0.25 bodu komentÃ¡Åe, vysvÄtlujÃ­cÃ­ obtÃ­Å¾nÄjÅ¡Ã­ ÄÃ¡sti kÃ³du - 0.5 bodu | M3: Celkem | N3: StartovnÃ­ ÄÃ­slo
A4: max | B4: 0 | C4: 2 | D4: 0.5 | E4: 1 | F4: 1 | G4: 2 | H4: 5 | I4: 2 | J4: 2 | K4: 1 | L4: 1 | M4: =SUM(RC[-11]:RC[-1]) -> 20 | N4: max
A5: 1 | M5: =SUM(RC[-11]:RC[-1]) -> 20 | N5: 1
A6: 2 | M6: =SUM(RC[-11]:RC[-1]) -> 20 | N6: 2
A7: 3 | M7: =SUM(RC[-11]:RC[-1]) -> 20 | N7: 3
A8: 4 | M8: =SUM(RC[-11]:RC[-1]) -> 20 | N8: 4
A9: 5 | M9: =SUM(RC[-11]:RC[-1]) -> 20 | N9: 5
A10: 6 | M10: =SUM(RC[-11]:RC[-1]) -> 20 | N10: 6
A11: 7 | M11: =SUM(RC[-11]:RC[-1]) -> 20 | N11: 7
A12: 8 | M12: =SUM(RC[-11]:RC[-1]) -> 20 | N12: 8
A13: 9 | M13: =SUM(RC[-11]:RC[-1]) -> 20 | N13: 9
A14: 10 | M14: =SUM(RC[-11]:RC[-1]) -> 20 | N14: 10
A15: 11 | M15: =SUM(RC[-11]:RC[-1]) -> 20 | N15: 11
A16: 12 | M16: =SUM(RC[-11]:RC[-1]) -> 20 | N16: 12
A17: 13 | M17: =SUM(RC[-11]:RC[-1]) -> 20 | N17: 13
A18: 14 | M18: =SUM(RC[-11]:RC[-1]) -> 20 | N18: 14
A19: 15 | M19: =SUM(RC[-11]:RC[-1]) -> 20 | N19: 15
A20: 16 | M20: =SUM(RC[-11]:RC[-1]) -> 20 | N20: 16
A21: 17 | M21: =SUM(RC[-11]:RC[-1]) -> 20 | N21: 17
A22: 18 | M22: =SUM(RC[-11]:RC[-1]) -> 20 | N22: 18
A23: 19 | M23: =SUM(RC[-11]:RC[-1]) -> 20 | N23: 19
A24: 20 | M24: =SUM(RC[-11]:RC[-1]) -> 20 | N24: 20
A25: 21 | M25: =SUM(RC[-11]:RC[-1]) -> 20 | N25: 21
A26: 22 | M26: =SUM(RC[-11]:RC[-1]) -> 20 | N26: 22
A27: 23 | M27: =SUM(RC[-11]:RC[-1]) -> 20 | N27: 23
A28: 24 | M28: =SUM(RC[-11]:RC[-1]) -> 20 | N28: 24
A29: 25 | M29: =SUM(RC[-11]:RC[-1]) -> 20 | N29: 25
A30: 26 | M30: =SUM(RC[-11]:RC[-1]) -> 20 | N30: 26
A31: 27 | M31: =SUM(RC[-11]:RC[-1]) -> 20 | N31: 27
A32: 28 | M32: =SUM(RC[-11]:RC[-1]) -> 20 | N32: 28
A33: 29 | M33: =SUM(RC[-11]:RC[-1]) -> 20 | N33: 29
A34: 30 | M34: =SUM(RC[-11]:RC[-1]) -> 20 | N34: 30

Sheet: Ãloha 3
A1: HodnocenÃ­ Ãºlohy PoÄÃ­tÃ¡nÃ­ stiskÅ¯ tlaÄÃ­tka
B2: HodnotÃ­cÃ­ kritÃ©ria
A3: StartovnÃ­ ÄÃ­slo | B3: ÃÄastnÃ­k nedodal vÃ½vojovÃ½ diagram, program je nefunkÄnÃ­. | C3: OdevzdanÃ½ vÃ½vojovÃ½ diagram je ÃºplnÃ½ a sprÃ¡vnÃ½. Pokud vÃ½vojovÃ½ diagram nenÃ­ ÃºplnÃ½, ale soutÄÅ¾Ã­cÃ­ alespoÅ nÄco odevzdal, dostane 0,5 bodu. | D3: Program pÅechÃ¡zÃ­ do programu PoÄÃ­tÃ¡nÃ­ stiskÅ¯ tlaÄÃ­tka (body se udÄlÃ­ pouze vÂ pÅÃ­padÄ, Å¾e ÃºÄastnÃ­k ÅeÅ¡il vÃ­ce jak jednu Ãºlohu). | E3: Program registruje a pÅiÄte stisk tlaÄÃ­tka. | F3: ZÃ¡kmity tlaÄÃ­tka jsou oÅ¡etÅeny s pouÅ¾itÃ­m pÅeruÅ¡enÃ­. | G3: Registrace stisku po uplynutÃ­ 5 sekund expiruje. | H3: Program na LCD displeji zobrazuje text PoÄet platnÃ½ch stiskÅ¯ xx. | I3: SvÃ­tÃ­ Å¾lutÃ¡ ledka, pokud nenÃ­ platnÃ½ Å¾Ã¡dnÃ½ stisk. | J3: SvÃ­tÃ­ zelenÃ¡ ledka, pokud je platnÃ½ jeden stisk. | K3: SvÃ­tÃ­ modrÃ¡ ledka, pokud jsou platnÃ© dva stisky. | L3: SvÃ­tÃ­ ÄervenÃ¡ ledka, pokud jsou platnÃ© tÅi a vÃ­ce stiskÅ¯. | M3: Program pÅechÃ¡zÃ­ do jinÃ© Ãºlohy (bod se udÄlÃ­ pouze vÂ pÅÃ­padÄ, Å¾e ÃºÄastnÃ­k ÅeÅ¡il vÃ­ce jak jednu Ãºlohu). | N3: Dokumentace a pÅehlednost zdrojovÃ©ho kÃ³du. Tento bod je dÄlenÃ½ pÅi dÃ­lÄÃ­m plnÄnÃ­ pÅehlednÃ½ a odsazovanÃ½ zdrojovÃ½ kÃ³d - 0.25 bodu konzistentnÄ a vÃ½stiÅ¾nÄ pojmenovanÃ© promÄnnÃ© - 0.25 bodu komentÃ¡Åe, vysvÄtlujÃ­cÃ­ obtÃ­Å¾nÄjÅ¡Ã­ ÄÃ¡sti kÃ³du - 0.5 bodu | O3: Celkem | P3: StartovnÃ­ ÄÃ­slo
A4: max | B4: 0 | C4: 2 | D4: 0.5 | E4: 1 | F4: 1 | G4: 2 | H4: 5 | I4: 2 | J4: 2 | K4: 2 | L4: 2 | M4: 1 | N4: 1 | O4: =SUM(RC[-13]:RC[-1]) -> 20 | P4: max
A5: 1 | O5: =SUM(RC[-13]:RC[-1]) -> 20 | P5: 1
A6: 2 | O6: =SUM(RC[-13]:RC[-1]) -> 20 | P6: 2
A7: 3 | O7: =SUM(RC[-13]:RC[-1]) -> 20 | P7: 3
A8: 4 | O8: =SUM(RC[-13]:RC[-1]) -> 20 | P8: 4
A9: 5 | O9: =SUM(RC[-13]:RC[-1]) -> 20 | P9: 5
A10: 6 | O10: =SUM(RC[-13]:RC[-1]) -> 20 | P10: 6
A11: 7 | O11: =SUM(RC[-13]:RC[-1]) -> 20 | P11: 7
A12: 8 | O12: =SUM(RC[-13]:RC[-1]) -> 20 | P12: 8
A13: 9 | O13: =SUM(RC[-13]:RC[-1]) -> 20 | P13: 9
A14: 10 | O14: =SUM(RC[-13]:RC[-1]) -> 20 | P14: 10
A15: 11 | O15: =SUM(RC[-13]:RC[-1]) -> 20 | P15: 11
A16: 12 | O16: =SUM(RC[-13]:RC[-1]) -> 20 | P16: 12
A17: 13 | O17: =SUM(RC[-13]:RC[-1]) -> 20 | P17: 13
A18: 14 | O18: =SUM(RC[-13]:RC[-1]) -> 20 | P18: 14
A19: 15 | O19: =SUM(RC[-13]:RC[-1]) -> 20 | P19: 15
A20: 16 | O20: =SUM(RC[-13]:RC[-1]) -> 20 | P20: 16
A21: 17 | O21: =SUM(RC[-13]:RC[-1]) -> 20 | P21: 17
A22: 18 | O22: =SUM(RC[-13]:RC[-1]) -> 20 | P22: 18
A23: 19 | O23: =SUM(RC[-13]:RC[-1]) -> 20 | P23: 19
A24: 20 | O24: =SUM(RC[-13]:RC[-1]) -> 20 | P24: 20
A25: 21 | O25: =SUM(RC[-13]:RC[-1]) -> 20 | P25: 21
A26: 22 | O26: =SUM(RC[-13]:RC[-1]) -> 20 | P26: 22
A27: 23 | O27: =SUM(RC[-13]:RC[-1]) -> 20 | P27: 23
A28: 24 | O28: =SUM(RC[-13]:RC[-1]) -> 20 | P28: 24
A29: 25 | O29: =SUM(RC[-13]:RC[-1]) -> 20 | P29: 25
A30: 26 | O30: =SUM(RC[-13]:RC[-1]) -> 20 | P30: 26
A31: 27 | O31: =SUM(RC[-13]:RC[-1]) -> 20 | P31: 27
A32: 28 | O32: =SUM(RC[-13]:RC[-1]) -> 20 | P32: 28
A33: 29 | O33: =SUM(RC[-13]:RC[-1]) -> 20 | P33: 29
A34: 30 | O34: =SUM(RC[-13]:RC[-1]) -> 20 | P34: 30

Sheet: Ãloha 4
A1: HodnocenÃ­ Ãºlohy Videostop
B2: HodnotÃ­cÃ­ kritÃ©ria
A3: StartovnÃ­ ÄÃ­slo | B3: ÃÄastnÃ­k nedodal vÃ½vojovÃ½ diagram, program je nefunkÄnÃ­. | C3: OdevzdanÃ½ vÃ½vojovÃ½ diagram je ÃºplnÃ½ a sprÃ¡vnÃ½. Pokud vÃ½vojovÃ½ diagram nenÃ­ ÃºplnÃ½, ale soutÄÅ¾Ã­cÃ­ alespoÅ nÄco odevzdal, dostane 0,5 bodu. | D3: Program pÅechÃ¡zÃ­ do programu Videostop (body se udÄlÃ­ pouze vÂ pÅÃ­padÄ, Å¾e ÃºÄastnÃ­k ÅeÅ¡il vÃ­ce jak jednu Ãºlohu). | E3: Program generuje 4 nÃ¡hodnÄ vybranÃ© znaky. | F3: Znaky se mÄnÃ­ po 0,5s. | G3: Program sprÃ¡vnÄ vyhodnocuje stisknutÃ© tlaÄÃ­tko. | H3: Program sprÃ¡vnÄ zobrazuje poÄet bodÅ¯. | I3: Program mÄÅÃ­ a zobrazuje Äas do konce. | J3: PÅi ÃºspÄÅ¡nÃ© odpovÄdi svÃ­tÃ­ zelenÃ¡ ledka. | K3: PÅi nesprÃ¡vnÃ© odpovÄdi svÃ­tÃ­ ÄervenÃ¡ ledka. | L3: PÅi vyprÅ¡enÃ­ Äasu svÃ­tÃ­ Å¾lutÃ¡ ledka. | M3: Program pÅechÃ¡zÃ­ do jinÃ© Ãºlohy (bod se udÄlÃ­ pouze vÂ pÅÃ­padÄ, Å¾e ÃºÄastnÃ­k ÅeÅ¡il vÃ­ce jak jednu Ãºlohu). | N3: Dokumentace a pÅehlednost zdrojovÃ©ho kÃ³du. Tento bod je dÄlenÃ½ pÅi dÃ­lÄÃ­m plnÄnÃ­ pÅehlednÃ½ a odsazovanÃ½ zdrojovÃ½ kÃ³d - 0.25 bodu konzistentnÄ a vÃ½stiÅ¾nÄ pojmenovanÃ© promÄnnÃ© - 0.25 bodu komentÃ¡Åe, vysvÄtlujÃ­cÃ­ obtÃ­Å¾nÄjÅ¡Ã­ ÄÃ¡sti kÃ³du - 0.5 bodu | O3: Celkem | P3: StartovnÃ­ ÄÃ­slo
A4: max | B4: 0 | C4: 2 | D4: 0.5 | E4: 1 | F4: 1 | G4: 2 | H4: 2 | I4: 2 | J4: 1 | K4: 1 | L4: 1 | M4: 1 | N4: 1 | O4: =SUM(RC[-13]:RC[-1]) -> 20 | P4: max
A5: 1 | O5: =SUM(RC[-13]:RC[-1]) -> 20 | P5: 1
A6: 2 | O6: =SUM(RC[-13]:RC[-1]) -> 20 | P6: 2
A7: 3 | O7: =SUM(RC[-13]:RC[-1]) -> 20 | P7: 3
A8: 4 | O8: =SUM(RC[-13]:RC[-1]) -> 20 | P8: 4
A9: 5 | O9: =SUM(RC[-13]:RC[-1]) -> 20 | P9: 5
A10: 6 | O10: =SUM(RC[-13]:RC[-1]) -> 20 | P10: 6
A11: 7 | O11: =SUM(RC[-13]:RC[-1]) -> 20 | P11: 7
A12: 8 | O12: =SUM(RC[-13]:RC[-1]) -> 20 | P12: 8
A13: 9 | O13: =SUM(RC[-13]:RC[-1]) -> 20 | P13: 9
A14: 10 | O14: =SUM(RC[-13]:RC[-1]) -> 20 | P14: 10
A15: 11 | O15: =SUM(RC[-13]:RC[-1]) -> 20 | P15: 11
A16: 12 | O16: =SUM(RC[-13]:RC[-1]) -> 20 | P16: 12
A17: 13 | O17: =SUM(RC[-13]:RC[-1]) -> 20 | P17: 13
A18: 14 | O18: =SUM(RC[-13]:RC[-1]) -> 20 | P18: 14
A19: 15 | O19: =SUM(RC[-13]:RC[-1]) -> 20 | P19: 15
A20: 16 | O20: =SUM(RC[-13]:RC[-1]) -> 20 | P20: 16
A21: 17 | O21: =SUM(RC[-13]:RC[-1]) -> 20 | P21: 17
A22: 18 | O22: =SUM(RC[-13]:RC[-1]) -> 20 | P22: 18
A23: 19 | O23: =SUM(RC[-13]:RC[-1]) -> 20 | P23: 19
A24: 20 | O24: =SUM(RC[-13]:RC[-1]) -> 20 | P24: 20
A25: 21 | O25: =SUM(RC[-13]:RC[-1]) -> 20 | P25: 21
A26: 22 | O26: =SUM(RC[-13]:RC[-1]) -> 20 | P26: 22
A27: 23 | O27: =SUM(RC[-13]:RC[-1]) -> 20 | P27: 23
A28: 24 | O28: =SUM(RC[-13]:RC[-1]) -> 20 | P28: 24
A29: 25 | O29: =SUM(RC[-13]:RC[-1]) -> 20 | P29: 25
A30: 26 | O30: =SUM(RC[-13]:RC[-1]) -> 20 | P30: 26
A31: 27 | O31: =SUM(RC[-13]:RC[-1]) -> 20 | P31: 27
A32: 28 | O32: =SUM(RC[-13]:RC[-1]) -> 20 | P32: 28
A33: 29 | O33: =SUM(RC[-13]:RC[-1]) -> 20 | P33: 29
A34: 30 | O34: =SUM(RC[-13]:RC[-1]) -> 20 | P34: 30